@JReubenCIark @JPBellum That ’ s why I distinguished between the two earlier . Obviously you think women who subscribe to abortion shouldn ’ t vote , but do you think women should just completely have that right revoked at large ?
@checkmatestate pro-life means you cannot be a liberal . doesn't matter if every other position aligns with them , the left doesn't all people who believe in the sanctity of life in their party .
I will never not be amazed at the fact that some men still think their opinions matter on abortion and women's health
And note how the TV can also be deployed to eradicate inconvenient people , such as the humans destroyed in abortion . The TV has drawn us into a simulation that represents this grotesque golden circle regime as normal . The TV has become an instrument of concealment & control .
@WordswithSteph So sad that many evangelicals are being duped for votes . They are pro-life but fight gun control which takes life . They are anti-LGBTQ but their President supports this demographic . They claim God is love and family values but tear immigrant families apart . Really ?
💜 🤘 We love to see it ! 🤘 💜 Pro Choice
Oh , I forgot one : Elizabeth May allows racists and anti-choice candidates into the party ? Must be the NDP's fault ! Elizabeth May quitting as Green Leader ? It's only because the NDP is forcing her to !
@scrowder Ignorance also triggers us . Ignorance that you think PP is the only abortion provider , that you think that is all they do , and that you think because some religious people believe life begins at conception , everyone must believe it . Freedom of religion also means freedom from it .
@prochoiceforal1 @giant_brain Do you support forced termination of human life in abortion ?
@ResistP @RodHillis1 @GGlocksX @JVER1 @RL9631 @Blessttt @T_FLgal @gbroh10 @sianetta @Melrpell @dyro874 @fordmb1 @janal811 @NJ_2_FL @colt6312 @tracied51 @308saiga @Arkiegirl01 @G_Actually @sohos1963 @hane_1964 @cassy9mm @Prolife_IAM @LaylaAlisha11 @hoppinmama5 @ImabitcSumtimes @OpressoraMariah @LuFerrer4 @saw4737 @am_mp @psico_FM @Andreia_Silva9 @F5Nando @Denise_RM_ @AnaCGonca @nzmendes1 @JaspionOpressor @dermatosp @SamBolsonaro @psspbru @JanaMillks2 @drika_rsf @MichelleK2019 @AnaCarolinBa @rejannealb @Leesoares_Br Paty ❤
@amerikendream @Prolife_IAM @Toddscrypto @dizzymom64 @Shopmom7 @Snack8671 @PennyLe15647073 @briantopping66 @dluvly21 @JanetTxBlessed @starkrob21 @kimn414 @QmagaMike @ASweetGirlInYou @EcomemoryGreen @My_Trigger11 @MRCRIDE Thanks for including me with these amazing Patriots !
@PaulKerseyFan @RealRonHoward @MissouriGOP @HawleyMO @SenHawleyPress @MoDemParty They reversed their policy about poisoning food for the homeless . Only Pro-Life Republicans would POISON FOOD FOR JESUS'S BLESSED POOR .
@_daphnayy You gotta say it the other way around fr . “ Being pro-choice doesn ’ t mean you ’ re anti pro-life ” . But being pro-life , due to the way they ’ ve politicized their “ movement ” , is inherently anti pro-choice .
@PrisonPlanet Don't worry , America already kills loads of children through evil abortion .
The Christian pro-lifers were so arrogant in their support of Bible-thumper / pedophile Roy Moore that they got a pro-choice Dem elected ... in freakin ’ Alabama .
@ShawnDugas5 @Tru1dy @HGracePeaceLig1 @anonforq Americ-islam is their goal . Abortion , tran / queer is fooling idiots into full fledged submissiveness and destruction . It's working for the useful idiots . The black hoods of Antifa are ushering in slavery of America . Multiply those who do not agree with such ideology . Get It Yet ? ?
Pro ako sa abortion . Divorce . Family Planning . Kung pro life ka , ' di ka bubuhay ng sanggol na papahirapan mo lang hanggang sa pagtanda niya . Mga ipokrito kayong lahat .
Only in the US do we execute the largest  of child murders yet convince ourselves it doesn't happen in the USA
@DharmaBones @politico But God's Elect can and do ! I just did ! You're welcome . It's amazing how much sincere ignorance & conscientious stupidity Godless Pro Abortion gurlz & boyz can overcome just by reading God's Word . Prolife Trumps Abortion
@laridious @julssnyder @NCManoukian @Texaswild7 @RobertZakchloe @Savingrace_ @MLaridious @Prolife_IAM @RainBadass @KBUSMC2 @Rykwilliamz @Kagboss @KimPKAG2020 @D_Eric_L @Sissy4Trump @Thomasbabineau6 @totemranch613 @XArmandKleinX @tee_maga @CountryTisOThee @evelynbae__ @stlpcs After a bucket load of joyful tears . I love you , Jesus loves you and Ifb .
POS now means Piece of Shiff KAG2020 @Heinric24712358 @Harleyluv @Brooke_Kelly87 @riki7s @cheri4trump @TheMazedog @heyitsCarolyn @ASweetGirlInYou @Harleytrouble @KAG1776MAGA @Silentwoo @AmVcore @KBUSMC2 @Kraknusa @fortressfin @VicCervantes3 @stlpcs MAGAROLLERCOASTER
@commonminer @jzharmon1 @mattyglesias He's definitely pro-life and that isn't an act . The pro life vote , especially of older typically republican voters is what will get him over the top of he wins . He doesn't sign that bill , he loses .
Wat een vrouwen zijn dit ! Ongelofelijk dapper ! " Dit is waarom ik voor het kindje koos ! " weekvanhetleven prolife via @YouTube
he even put the trademark bro
Yeah why mad they do that every day and eat the corpses every Sunday at Planned Parenthood .
Facts : Roughly 1 million abortions are performed each year — 2,700 per day Planned Parenthood alone performs over 900 abortions every single day 53 million have been performed since Roe V . Wade We will be judged generations from now by how we deal with this horror
Time flies when you don ’ t have to constantly worry about things like abortion becoming illegal in your state .
a girl with a miraculous medal and an " I stand with planned Parenthood " sticker I feel sick
I ’ m pro choice always have been because what else is life but choices you get to make ! !
@blu_feminist @dylanmattress @Pro_life_ANCAP @candktoo I only have one account .
I ’ ve never been at a point where I could have kids even if I had wanted to . I ’ m pro choice but I don ’ t relish the idea of getting an abortion when there ’ s a better way . Thx Birth Control for allowing me to take control of my life . That way no man , or unplanned pregnancy , could .
Democrats Want to Impeach President Donald Trump Because He ’ s a Pro-Life Champion on Abortion BREAKING News
@aeb082917 That's not difficult at all . It looks like pro-life Christians saying it requires a marginalized identity to understand Jesus and interpret the Bible , that the only point of the Gospel is Social Justice , and that your church is and always has been racist , so elevate minorities .
I had a miscarriage and lost my baby . It was taken away from me . I ’ m still pro-choice . Every single woman deserves the right to make choices that impact her life .
And i oop - -
@MindsRising1 Roussel-Uclaf , ... RU - 486 abortion pill ... subsidiary of Hoechst AG , a German pharmaceutical company that developed some of the poisonous gas compounds that were used by the Nazis to kill Jews and other “ undesirables ” in death camps during the Holocaust .
The Declaration of Independence gives us three examples of “ Unalienable Rights ” " Life , Liberty and the pursuit of Happiness ” Abortion takes all three of these rights away ! prolife
🗞 🗞 🗞
Hate Group Leader Franklin Graham Calls on Pastors and Priests to Deny Pro-Choice Politicians Communion Like One Just Did to Joe Biden @Franklin_Graham pedophiles rapists Perverts Evil Religion
I haven ’ t read anything more untrue today as this .
For everyone griping about Nikki Haley--fairly or unfairly--name a conservative , pro-life alternative . In the space between President Trump and the Democrats , I don't see any better future candidate . I would trust her as president .
Don't eat a girls pussy if she had an abortion because that pussy may be haunted
@Liz_Wheeler There is no connection between DANCING and ABORTION ! ! I am against abortion but DWTS is a dance competition NOT POLITICS ! !
@pastorkenrp @TheLayArtiste The young women who ’ s bodies these babies are ripped from have nothing to do with it ? Wow . It has * everything * to do with it . Until we get to the heart of the problem we will not abolish abortion which is what we both want .
@og_dbl_lo_g @h8Wankmaggot45 3 . As a child born to an unwed mother who did not have a right to choose ( prior to 1969 ) , my positions on abortion are complicated . My mother's mother reaction to her lack of choice was to become staunchly pro-life . She points to the fact that she would have aborted me .
Unconscionable . This is not women ’ s health . This is not a woman ’ s “ right to choose ” . This is murder of a newborn . Democrats running in 2020 should be asked if they agree . Democrats not running in 2020 should be asked if they agree .
Birth Control reduces the need for abortion , rates of unplanned pregnancies & fewer unplanned pregnancies means fewer abortions . Nationally , when birth control use goes up , abortion goes down . Book your appointment now 01265230 32 we also do HI Vtesting askaman Girls Talk ZA
@AnjiPassion @g22dude11 @Feisty_FL Well if you close your eyes and plug your ears you're right , kids aren't in cages . Reality sucks huh ? 😭 😭 😭 I'm sure the locked up kid's will be glad you're denying their existence . It's so pro-life of you .
@Problemspartof @LeahNTorres As previously tweeted . I trust that pregnant people are able to make good , ethical decisions for themselves without your help . That means that nobody healthy with a healthy foetus will all of a sudden go looking for an abortion at some late stage . Laws are not necessary
@maimonides_nutz @DrJenGunter Yeah , that tweet really stung for me too . I ’ ve never had an abortion , but I had a really awful and traumatic miscarriage at seven weeks , and it really bugs me to feel like people are saying “ it ’ s no big deal ” in the name of politics .
Vitamin E Casule Prolife Atlas Beware of fake . Original ni 150pesos only
" Abortion services in Northern Ireland must be based on the realities of people ’ s daily lives , as well as scientific evidence on the safety and effectiveness of both medical and surgical abortion . " BMJ Editorial by Abigail RA Aiken and @DrBloomer
@jmartin031990 You seem to think the goal is to defend the Dems on abortion . It's not . It's to lessen evil , not support the lesser evil . Meanwhile , you actively support the greater evil . Try thinking with the Church , not FOX , Limbaugh , talk radio , and Arroyo .
@theR_Mann @SJPFISH @Cromag_19 @ec_kag @ronmolina @alwayzsomethin @ResistingSnowF1 @Craybo23 @Cynthia37765945 @TrumpTony4 @kent_nye @SSGRappelMaster @Prolife_IAM @MAGAPATRIOT_TG @CristalKing @QTAnon1 @2020_Bury_Them @Dvscott81Scott all
As restrictive state laws make getting an abortion more and more difficult for too many people across the country , we ’ re here to help connect patients to the abortion services they need .
Protesting against art , even an anti-abortion film , is not a good look
@laridious @GI4Jane @PS16v6 @CAMAYUSA2 @ClemRichards @CountryTisOThee @Prolife_IAM @RainBadass @WA_Silenced_Maj @MLaridious @laurelsobol @littlestpigs @michaeljohns @IndianaMike75 @WinstonCovfefeR @bill_donaghy @BobPage43 @MarkKirin Thanks for the lift !
@fire_H2o_ice @OmasholaK Scientist have confirmed @fire_H2o_ice is an asshole 🤭 I wish ur mama utilize her abortion money , then u for no dey here dey talk nonsense . 😜 Shola has fans .
@Prolife_IAM @pastorjerryccm @renee_being @Republikeme @SauterRory @ShannaMartella @Dbargen @SL_OKC @SonnyWhee @StupidCanKill @tammyonthetrain @MRCRIDE @Toddscrypto @TheTotalWipeout @TheTrump2020 @travislovell76 @wearewhiterose_ @XArmandKleinX @League_Patriots Trump 2020 @CJI5970
How do you de-stigmatize murder ? Actress Elizabeth Banks Will Head Pro-Abortion Group , Wants to “ De-Stigmatize ” Killing Babies in Abortion ...
New York Judge Rejects Rule Allowing Clinicians to Religiously or Morally Object to Providing Abortions business feedly
@HTUabortionpill @safe2choose @IpasOrg @WGNRR @Safe_Abortion @rhnkorg @GhScora @DonCorleAnn Considering most women are unaware that abortions are legal in many countries , laws need to be explicit . Additionally , when laws enable this , more awareness occurs & stigma burden reduces . This increases the no . of safe abortions & lowers maternal mortality . I March For Safe Abortion
Andrew Scheer is effectively pro-choice , why not just own it ? : Neil Macdonald We appreciated this article 👍 🏻 !
' Voicemail for Jill ' by @amandapalmer always makes me cry . I wish I'd had a friend like her when I had my abortion .
@CholesTroll It's an animal , , , but u shouldn't make it suffer unnecessary , , , in abortion they stick scissors into the baby's neck , , the suck the brain out ... If born of abortion they let it die on the table or break his neck .
@WalshFreedom @HouseGOP @SenateGOP don ’ t care about the @constitutionbwy . They are focused on enriching the @1percent , destroying environmentalhealth , reduce women reproductive rights , and limit LGBT rights .
late term abortion
@maryquint7 @RealSaavedra @StacyLStiles Full term abortions where do you get your information ? What Doctor in the US are you assuming would do a full term abortion ? Where is your brain ? 👇 🏽
@zizibutterfly @TatsNkonzo No , No & No ! Abortion is not healthcare . Abortion should only be seen as a very last option for reasons NOT to do with someone's irresponsibility of not using condoms or birth control . If you don't want kids ... use both control or tell your man to use a condom .
@Charmzy_P @SAfAIDS These legal barriers automatically drive AGYW to resort to unsafe abortions as well as delay in seeking help for for abortion-related complications . There is need for the relaxation of the TOP Act in Zambia . right2access SRHR @SAfAIDS
@BellemareSascha @NNorma192 @AndrewScheer What is the big deal if anyone does not agree with same sex marriage ? Does not make you a bad person . So what if he refuses to attend a pride parade . I don ’ t agree with same sex marriage , and I will never attend a pride parade . I am also prolife , my choice .
@StephanieHazen @snoopuhh I ’ m gonna die on the pro-life hill . Irony notwithstanding .
@BeeAmellia yOu'Re NoT pRo-LiFe YoU'rE jUsT pRo-BiRtH
Investing $ 20 million in State & Local elections to ensure that Pro-Choice women are in office ( Virginia ? ) is so bad ! Flipping the U . S . House and electing the largest number of women and minority women in history is BAD ! Think before you make another bad take , Chief of staff .
@DanielCameronAG @KYComer So much for pro-life . Getting support from someone who forced an abortion on their girlfriend ? ? ? Bevin supports a pro-choice candidate and now you getting support from a pro-abortion candidate ? ?
( The policy language is definitely pro-choice ; it was just clearly written by ppl with no idea about what they were talking about ) 🤷 🏻 ‍ ♀ ️
@Tiber_Swimmer It's literally a thread about Stephen Miller's leaked emails and the immigration policies he authored that dehumanize brown people , and you crashed it when I said those people are anti-choice , not pro-life . So yes , at the very least your situational awareness is fucked up .
Boy , I was really worried about our Alabama Senate seat this election . Now , not as much . I mean , what chance does Abortion Doug Jones against Stealthy Sessions ? ? Yeehaw !
Abortion . I am adopted , I am against it ... Stop pushing anti abortion laws PLEASE ! you are losing voters because of it and it is a hell of a lot more important that our country not turn socialist than our country be pro-life . Many modern women will not even consider voting
Fight Back Campaign Notinourname NOT4NI Nothernireland Prolife
@DeanCookJr @SenateGOP Every one of those judges were harvested from a list of the most fanatical anti-choice names available . With a squadron of these women-controlling justices , all women with a uterus will be in danger of losing their rights and being forced to carry pregnancies against their will .
Hey , Business is Business ! What do you want from me ? !
@DanRather @trumpharmsusall What is the point Mr Rather The republicans are in it for the long haul They are propping up Trp in order to hold power and control Guns Abortion and Immigration are motivating them to ignore the facts and insult our intelligence It is absurd to think they will come around
@ScottMcDonnell_ @boston25 WTF r they protesting ? ? I ’ m sure all of them support abortion , murdering baby ’ s
@cat_the_cat_cat Hunny . I myself am ProChoice but I've read into the ProLife statements , I've got my ACTUAL argument still being written and formatted properly ( with less cussing ) . Issa joke . Not a dick ( or a strapon if you're into that ) . Don't take it so hard .
@kathykidd63 @liberalsmasher1 @Education4Libs @suepatroit And this truth scares abortion supporters to their core so they create other diversions that create a storm of pro choice REASONING that has nothing to do with truth ( it ’ s a life ) or logic ( it ’ s murder )
Last week , the Care Net Pregnancy Center of Kittitas County celebrated 25 years of offering compassion , hope , & help to their community ! THANK YOU for all you do ! carenet prolife proabundantlife
@DavQuinn She can't possibly be a hypocrite though , because she's pro-abortion and she wants 5 year olds to be ' porn-literate ' . She's so ' woke ' she's almost an insomniac .
For a number of years now , and in many contexts , disability & women ’ s rights advocates have been talking together about the sensitive issues of abortion & prenatal testing . With Nairobi Summit beginning this week , here's an intersectional read - ICPD25
@ABC Watch Virginia now that Dems are in control because you ’ ll see their crime rate rocket , taxes will be increased , companies will not want to set up shop there , homeless rate will increase , abortion will become illegal . And all this over a few years .
Someone at work asked me about politics . Over the duration of the convo I stated that I'm anti-voting , pro-life , anti-cop , pro-free market & anti-government . Then he said to me " So are you right-wing ? Do you vote Liberal ? " Mandatory voting makes the Stockholm Syndrome run deep .
@BamaTitan34 RU4R great God-sent pro-life Pres.Trump fighting MUSLIM OBAMA DUPED DEMS 4 🇺 🇸 W / 0 pay ! Future Gens / R kids LIVES DEPEND on R WISDOM ! 🇺 🇸 WALL , W / BIG GATE 2 VET ! ISLAM FIGHTS 4 WORLD DOMINATION ! KORAN = “ KILL NON-MUSLIM INFIDELS ! ” ! ISIS BEHEADS / STEALS 11yr.old BRIDES ! 🙏 🏻 Grammy
@ksserendipity Abortion is the intentional killing of a unique human . When you believe life begins at conception , then murder it is . I don't expect you to agree , but that's the entire point of the pro-life movement .
@Cleanman0 @AaronLeuer @J_MAGA_777 @phillyeaglesfa1 @LaylaAlisha11 @4AmericanKat @briantopping66 @MRCRIDE @GregMusselwhit3 @PappysFRNTPorch @Brooke_Kelly87 @crtoloss @DebraAmerican @QmagaMike @Prolife_IAM @steveDalTx IFB 🔄 MAGA Patriots 💯 . Thank you , Cleanman 0 ‼ ️ 👍 🇺 🇲 🇺 🇲
shu has to either heat their classrooms or stop sending me emails about pro life events it ’ s either one or the other sorry can ’ t have both
@HeidiSchlumpf @NCRonline @Bishopoftyler We must consider the world pregnant mothers live in and the world their infants will be born into . Focus on abortion alone is insufficient .
@katylynn2343 @PatriotFightUSA @GetOverItMedia1 @KarenLadybug1 @MRCRIDE @Patti_Sc60 @Jennifervan917 @D_Dextra @BobFalfa55 @mickelodoole @Prolife_IAM @Bluepit19651 @calder_price @TNTLEE34 @JamesPidd @League_Patriots @Steff8500 @BlackfootJon2 @koooski @markkirin_ You aren t showing following me
I just unfollowed a shit ton of accounts that I am not even sure why I was following in the first place . I want to follow more dogs , musicians , NHL , and liberal pro-choice accounts . Help me out , Twitter .
she must dont know you done killed 2 of my sons already ? chose the wrong person to argue w / smh
@League_Patriots @CylonGalactica @Dilligaff1962 @MaysPatriot @TrumpFanNevada @Bubbalouwie @Prolife_IAM @KarenLadybug1 @Dvscott81Scott @Toddscrypto @MRCRIDE @tagruber @9mmcassy @fatima_italia @KimPKAG2020 @YC727USA @Patti_Sc60 😀 👊 🇺 🇸 👍
The consultation highlights the role that midwives and nurses can play in abortion care and indicates that provision of early medical abortion should not be restricted to doctors
@Brooke_Kelly87 @DorrellDana I JUST RETWEETED AND FOLLOWED HER TRUMP2020 WWG1WGA MAGA KAG BUILDTHEWALL PROLIFE BACKTHEBLUE VETERANSOVERILLEGALS NEVERFORGETBENGHAZHI DRAINTHESWAMP WOMENFORTRUMP FREEGENERALFLYNN
@RenoCow @awkwardo @CBSThisMorning @CBSNews @DonaldJTrumpJr Isn ’ t this the “ post birth abortion “ ( slaughter ) of innocent animals that junior is always lying & claiming the left supports ? Prolife ? ! Hardly ! Hunting for sport is murder .
@true_pundit Anyone supporting PP or supporting politicians who support PP and abortion are disgusting . Like in most demmie supported garbage - follow the money .
This man ’ s name is Leroy Carhart . He has killed tens-of-thousands of children in the womb , including hundreds in the latest stages of pregnancy . For three decades people have tried to warn him that abortion doesn ’ t ...
prolife prowoman profamily
I have to say that I love when pro-aborts tag me on social media . Almost every time , I get a message from a woman considering abortion who is looking for counsel . And almost every time , she chooses life . Tag away ! !
@PaulBois39 Great article ! Pro-life abortion law history links : Dr . Storer became a Catholic later in life .
@supangelicaa The way I ’ ve always talked about it is that you can be pro-choice and also anti-abortion . Just because you wouldn ’ t get one yourself doesn ’ t mean you should make that decision for everyone else .
@Joshua4Congress @DanielShull6 Rep . Denny Heck for Congress . 100 % scores from the Human Rights Campaign and Planned Parenthood . He boasts a 94 % ranking from the League of Conservation Voters .
- Advocate responsible , physically present , fatherhood
@zjonrum Just letting you know I'll never support abortion .
This is a disgusting and sexist mentality to have , and unfortunately how the majority , if not all , of prolife thinks . They don ’ t see women as people , only as breeders who are worth nothing if they don ’ t have kids . They don ’ t care about women , only dehumanizing them . prochoice
my english teacher used abortion as an example for an argumentative essay and this man is heated af . ok . get me out .
Kindly read about our mock Tribunal on Sexual and Reproductive Health and Rights featured on @vanguardngrnews
How do extreme pro life people still exist ? prochoice
Jon Tonge : Whisper it , but Sinn Fein could be happy with victory for Boris Johnson = Sinn Fein have gone off the rails since the signing of the GFA and they will have lost a lot of support especially over welfare cuts , abortion and austerity .
That is because Pope Francis is a Faux-Pope . He isn't legitimate ! He is an arm of Globalism and nothing more . So take that to the bank baby-killer !
@mashable abortion , baby parts markets , all things LGBTQPP , drag queens teaching toddlers , satanism , atheism , socialism , crime ridden open borders , antifa , voter fraud , election meddling , censorship , Unruliness , gutted Bill of Rights ... Do you stand with God ? Or satan ? You choose satan !
You forgot : - Don't take the last names of their husbands - Expect their partners be stay-at-home dads . - Bathe in the tears of men - Neg all the men in their lives - Have abortion reveal parties
Just when I thought Kanye couldn ’ t be more trash ... he decided to bash abortion rights . Disgusting
Pro-Life Message Resonates from ABC ’ s ' The Good Doctor ' - Latest Comments
@MR40TILFIVE U realize that if a woman is nauseous becuz she ’ s pregnant , plan b won ’ t do a damn thing . Plan b is emergency contraceptive that only works up to 72 hours after sex . Not an abortion pill .
Caitlin Snow is pro-choice
@SnizeMaster @JuanjoBeni I think we have misjudged how ‘ shite ’ Hassan is ... unforced errors upon errors upon errors , it ’ s like an abortion clinic out there .
@dave_spirit2001 @SirajAHashmi Its hard for some people to forgive him going after acorn and planned parenthood .
@XplosiveTweets @Naiad_A_ @FreckledLiberty " When does life begin " is a non-sequitor . Anyone arguing that a fetus isn't alive is either uninformed or dishonest . The question of the morality , and subsequently the legality , of abortion is at what point is a fetus able to respond to pain ? Consensus is ~ 27 weeks . 1 / x
If youre prolife please unfollow me , thank you
Senator Ekland speaks in favor of SB 155 saying it gives people choices . No sir - giving misinformation to stigmatize abortion is not a choice , it ’ s deception . Stop The Lies
jakas laska z ktora sie niedawno klocilem teraz ma caly profil poswiecony byciu prolife i nawet na ikonce i headerze ma male dziecko xd
@emilyslist Devil we rebuke you ! Pro Life All Lives Matter Trump2020
IN 2 DAYS : We are hosting a Pillars of Personhood Seminar in partnership with @GRTL on November 9th @ Nesbitt in room 3110A . Come learn about the impact of abortion , euthanasia , embryonic stem cell research , and more ! Pro Life Pro Life Is Pro Woman Pro Life Is Pro Science
Pro-life women at the United Nations decimate the idea of the " right to choose . " " Right to choose what ? What are they choosing ? " @LilaGraceRose 🔥 🔥 🔥 Share this video .
@aderangedhyena @MadamS8N @mwaechter @notabrokenthing @kevinhay77 @prochoiceforal1 I accept that men be able to give up their parental rights but women still need to be held to account for any reproductive coercion they perpetrate
