This year marks the 25th anniversary of #ICPD . It revolutionised the way #SRHR is viewed , but still , we're miles away from achieving gender equality . #Abortion is still spoken in caveats . Isn ’ t access to safe abortion integral to #SRH ? #ICPD25 #ICPDNairobiSummit #PratigyaRights
THREAD 2 / x Almost immediately after the election , the opening gambit for the poison pill was played . " We should have dragged Scheer to a Pride parade . That hurt us in the GTA . Abortion hurt us in Quebec ; same-sex marriage hurt us in the GTA . " - CPC anon
Look now lol
is this the Virginia you are all gaga about this morning ?
While screaming PROLIFE at the top of their lungs .
I ’ ve tweeted this multiple time ’ s - this number is easily in the hundreds .
Feminism is evil ; it only has power to destroy . It places women in places / roles where they weren ’ t meant to be . It is the raison d ’ etre for abortion in the first place . Crushing feminism is the key to crushing abortion . End the diabolical marriage of pro-life and feminism
Hope you're right about abortion ending but doubt it will until contraception is dropped as this is the evil root cause & folks love contraception
Someone needs to teach this lady about birth control ... Planned Parenthood made quite a bit of money off of selling all her baby body parts
I fucking love Planned Parenthood
I mentioned how the founder of Planned Parenthood would be pleased with how many African Americans babies are being aborted . I said nothing about " POC " , and how they have limited opportunities . I believe the opposite of that , that they have as much opportunities for success as me
If abortion is murder , then what is a miscarriage ? manslaughter ?
THIS is what a #nazi sounds like so let's stop calling people who don't agree with the left Nazi's . Someone who dislikes Bernie isn't a Nazi . Someone who is Pro-Life isn't a Nazi . Some who has voted or run as a Republican isn't a Nazi . This is . So stop softening the terms meaning
It's your choice RS but for me if Tories have any chance I'd vote for them because if Boris loses it's no Brexit ever and a Marxist terror supporting anti semetic cur in power . And you never get rid of them without bloodshed Venezuela , Zimbabwe , USSR .
Mr . Adler apparently thinks that Canada's abortion regime--which permits feticide until birth--is an essential part of our " civilizing glue . " Okay , boomer .
Thank you for an outstanding ride with all these great Patriots Friends please follow
Acting out sexually on impulse is sacrificing one another ’ s ID for the ego gratification of another . What could go wrong ? Never mind the likely STDs & the likelihood of creating an inconvenient life that will pay the price for the lack of self-control if the life ends in abortion
When someone you actually like explicitly tells you they ’ re pro-life and wants to work for pro-life activist organization
Seems like a Satanic priest to me . Sick sick sick !
How to destroy a society in eight simple steps . 1 . Remove God . 2 . Promote abortion . 3 . Promote p * rn . 4 . Promote promiscuity . 5 . Make people forget their history . 6 . Replace culture with globalism . 7 . Replace beauty with ugliness . 8 . Indoctrinate with propaganda .
New from : NARAL is endorsing in her bid to take on Joni Ernst in the #IASen race
Lobby petitions government over ICPD 25 + conference on reproductive health rights
Im not looking through your stuff . Im asking you straight out . The answer is either yes or no . Do you support abortion ?
All this is saying that . abortion should be up to the female . Rates have went down . But the big issue is WHY are black women having the highest rates . Then you find the real answer like unemployment , lack of education , scarce mental health support systems .
“ No one is pro-abortion . ” False . I ’ m pro-abortion . Abortion is not a dirty word . It ’ s a medical procedure .
Bull , Amsterdam and one other also in the same week are pushing abortion .
nah its " leftist ... yet also pro-life 😉 🙏 ! " liz
This Daniel Cameron ... against abortion and a conservative ... maybe we should let him pay for all of the babies born not wanted or due to rape / incest .. you know , dump them on his doorstep and garnish his wages to pay for their care .
The #UMC believes that the culture and traditions of all persons are sacred . We are committed to protecting and preserving the rights of babies who are not given a chance to live in the name of social and political mores . #BabiesArePeopleToo #AbortionIsMurder
Elizabeth Cady Stanton is best known as an advocate for women ’ s rights , including the right to vote . She was not only pro-woman , she was also pro-life . ⠀ ⠀ ⠀ Find other great pro-life , pro-woman quotes in a …
You do understand that abortion is the murder of babies , right ?
You ’ ve also fought against desegregation , women ’ s reproductive rights and made it impossible for people who use bankruptcy to clear student debt . THAT ’ S not something anyone else in this primary can say .
Maybe he works for planned parenthood and it was simply a reflex to seeing a baby .
Right 😭 and independent judge-lef inquiry is much needed in Hong Kong , for all the brutal things happening here right now 😖 😖 😖 🔥 thank you for voicing out for us ! !
Abortion is Murder ! “ Can ’ t You See ” is now available Spotify & ITunes … .. by , Evon Latrail #evonlatrail #prolife
Huge shout out to my Digital Products collegues for building and launching a digital tool to declutter the mess around abortion access .
Dear men that don ’ t want children ... why is it suitable for a woman to get an abortion or take unhealthy medication on a regular that will damage her in the future when she do want to have a family but it ’ s not suitable for y ’ all to get a vasectomy 🤭 🤔 ?
Hmmm
Judge Rejects Moral-Objection Rule for Abortion Providers : A federal judge has struck down a new rule , not yet in effect , that allowed health care clinicians to refuse participation in abortions and other services on moral or religious grounds .
Lord , destroy every evil doer that promotes this sick thought , IN JESUS NAME ! ! ! 🙏 🙏 🙏
Professional Medical Associations like oppose mandatory parental involvement and abortion decisions makings . #AskFLLeg
Choose away . I ’ m pro-choice so no problem
“ Choose life ” in combination with anti-abortion efforts to institute bans , delays , and other regulations meant to reduce access - either directly or indirectly ( like the Title X gag rule ) isn ’ t a choice . It ’ s government coercion .
“ When reproductive freedom becomes a class privilege , the human rights of our political body are negated . ”
Homosexuality is sin , abortion is sin ! The bible is very clear clear that no homosexual or murderer will see the Kingdom of God ! And therefore for any human being to support the same , it's absolutely insane and immoral ! #LetterToTheState
Nope , they'll just be forced to provide a safe , perfectly LEGAL medical procedure . Don't like it ? Don't get an abortion . Problem solved .
No matter how you feel about the abortion debate , why in hell would you want someone who objects to abortion , to perform yours ? It ’ s also plainly unenforceable .
If you are against abortion just unfollow and block me PLEASE I BEG U . Abort yourself from my profile buy bye
4th from the bottom TrumpJordyn doesn ’ t show up . FYI
yes , abortion should be legal so that whoever wants to terminate is free to do so , not to be criminalized .
I can agree with that , I don ’ t like abortion but it ’ s not my choice to decide for ppl . Prevention is key , but of course nobody agrees on how to properly educate that leads to prevention . Good news is , abortion is on the decline nationally .
Men have reproductive responsibilities but no reproductive rights .
What ’ s up with this abortionist ? did he kill born alive babies in self defense ?
one cool thing about supporting awesome pro-choice democratic women is the real sisterhood shared among them — hugs , acknowledgments , and such a beautiful community . we ’ re so lucky . thanks , ⁦ ⁩ , ⁦ ⁩ , ⁦ ⁩
has nominated great people to our federal courts . Lawrence VanDyke is pro-life , #1A and 2A . #VoteRedToSaveAmerica #DemocratsDestroyedThemselves
If you ’ re an American democrat you put your babies in plastic bags for some slightly late term abortion while supporting spending billions on illegal immigrants and their kids to give them a bright future .
Thanks for the ride ! 🇺 🇸 💋 💄 🙏 👠 😘
I knew it . There was the perfect mix of faith and kids that I just knew that teenager was on her way to get an abortion . Wonder if this is the episode Benson talks about hers . #svu
Abortion Consultant Admits Getting Baby Parts Is a ‘ Game ’ - Liberty Counsel
“ Abortion activists filed a lawsuit recently that could force Minnesota to allow unrestricted abortion on demand , including for young girls without their parents ’ knowledge or consent . ” Via
A Plea for Catholic Bishops Tend my sheep . ( John 21:16 ) #Catholic #ProLife via Toupsfamily
I did a fast against abortion .
How about Planned Parenthood while you're at it ? 🧐 Too bad it's never gonna happen so keep dreaming soy boy .
Hopefully they invited her in for a conversion ... if not ... the members might want to start seeking new leadership . Her stance on abortion alone is a direct conflict with the will of God .
NARAL Pro-Choice America is hiring a National Political Director in DC , salary $ 90,000 - $ 142,000 . No benefits listed .
This societal weakening of traditional morality then moves back to the remaining structures of the Church ( CofE ) and restates the morality they teach . I . e , in a few generations they have LGBTQ , Abortion , leftist political fads etc .
We agree ! #IMarchForSafeAbortion cc
If I'm gonna believe that the President knew a porn actress , I'm gonna believe he had sex with her
Gun control should not be a controversial issue . Guns are specifically designed to kill . Built to kill , bought to kill , used to kill . Don ’ t ever say you ’ re pro-life if you like guns . That ’ s BS . #GunControlNow
If you look at the most liberal pro choice societies like Scandinavia they have seen the wage gap increase with more choice .
Why would people who say they are Pro-life not want people to have a plan before becoming parents ? Un-planned parenthood rarely works out well for anyone involved .
I was drawn to the issue of abortion because as someone with OCD , moral rigidity and shame have always been front and center . The abortion wars are driven by moral rigidity and shame .
Thank you Rain 🥰 🇺 🇸 🇬 🇧
Both are bad a baby doesn't get to even live though in abortion though !
Słowa mają znaczenie ‼ ️ Protestuj przeciw pogardzie dla życia nienarodzonych . 👉 #Nieplanowane #ProLife
Curioso debate en la sobre el aborto donde el lado #ProLife eran personas que ya abortaron alguna vez y que en su país el aborto es legal . #Abortolegal ¿ porque quitarle el derecho a alguien de hacer lo que tú ya hiciste ?
There goes California again . They reward criminals yet criminalize the innocent . Drug addiction isn't something she asked for . I doubt she wanted that outcome . But if she did want that outcome , she could have an abortion and that's legal . How confusing and messed up .
he were like ‘ abortion should be illegal if you don ’ t want a baby just use a condom ’ then someone was like ‘ condoms can break tho ’ n he was like ‘ still their fault , they know that can happen ’ ? ? ?
I'm saying that we need a range of MPs that can bring different ideas and experiences to the parliament that shapes our laws and policies . For example abortion , it would be ridiculous to have a 10 man committee with no women .
Virginia's all right , if you like blackface ... abortion , and rape
Sacrifice to Molech : New Pro-Abortion Campaign Calls Killing Babies an “ Act of Love and Compassion ”
Medical PROFESSIONALS ? Being on the janitorial clean up crew at the local Planned Parenthood does not make you a medical PROFFESIONAL !
He is pro-choice , and his is a coastal elite from Wall Street you dolt .
Indeed . Some of us are old enough to remember the organised media trolling of that veteran anti-fascist Michael Foot for his choice of overcoat at the Cenotaph .
For a minister knowingly to admit a pro-abortion politician to Holy Communion would be an act of incredible cruelty . To be a true Church of mercy is to be honest with the public sinner , to encourage him to repent , and to receive him lovingly and ...
Sex-selective abortion to protect women ! Or something .
There ’ s absolutely no reason to do this to your own child and I guess he ’ s “ pro life ” . I can never understand nor endorse any form homophobia . Peoples lives are at risk because of it !
We applaud and thank reproductive rights advocate for running a great campaign and for standing strong on reproductive health and rights .
No , that ’ s exactly what takes place during late term abortions . Have you ever stopped to think about what occurs during the procedure ? Most people claim to identify as pro-choice due to propaganda and the popular “ my body , my choice ” phrase .
#ICPD25 is a conference that will have to confront the inequalities that exist in our world today especially in the area of reproductive rights #NairobiSummit
He is not pro choice and I cannot compromise that
Come along to this vital conference with some fascinating speakers ( and me ! ) . Friday at Westminster Chapel , 10am - 4pm .
Absolutely . Women will have to give up sex 4 life anyway if the Gilead assault on reproductive rights continues another 5 years , anyway . 😟
Going to Planned Parenthood to protest America's appalling abortion shortage .
Abortion ends any potential greatness that the child possesses . Adoption is the loving option . ❤ ❤ #NationalAdoptionMonth
Abortion isn't safe or rare . Healthy babies at seven , eight and nine months are being aborted in the U . S . It's a grave injustice that children are legally being murdered in the womb , and it needs to stop .
We wont know the truth unless investigation
#LaureTheLiar , show us , where in the Constittution is the right to " Murder a baby in the womb " protected . Just because the Supreme Court ruled in favor of abortion , does not make it a Constitutional right . You should realize that the Constitution does not Give people rights .
Joe you have no clue who god is ! He ’ s definitely not in the Democrats party ! They believe in murdering babies ! Abortion ! Rape of Children ! Epstein , Clinton ! And allowing criminals to take over our cities ! MS 13 ! ! ! Your such a Hypocrite ! ! Jesus says protect the little children !
Time that some Democrat leaders speak for Pro-Life causes . Silence isn ’ t golden , just yellow .
Abortion should remain legal in cases of medical necessity . I ’ d even go so far as to say not only ectopic pregnancies , but also in cases of treatable disease diagnoses that would end or seriously harm existing pregnancies but where a woman risks her life without treatment .
Our third publication is a charity zine exploring reproductive justice and abortion rights - really really proud of this one . ✨ So many amazing contributions / contributors which I will no doubt shout about later ; available to pre-order now !
After seeing this beautiful face how can anyone believe in abortion ? ? ?
🛑 Gateway Pundit News 🛑 👉 Obama-Appointed Judge Blocks Trump ’ s ‘ Conscience ’ Rights That Allow Doctors to Refuse to Perform Abortions #MAGA 🇺 🇸 ￼ ￼ #2A #Prolife
Mary , It ’ s really not . It ’ s happening now . It happened in 2016 . People who identify themselves as pro-life ( they ’ re not pro-LIFE , just pro-birth ) will vote for a Republican candidate over a democrat for no other reason than the Republican claims to be pro-life . 1/2
She has a lot of abuse of power in her past when she was Attorney General Kamala Harris & #8217 ; Office Collaborated With Planned Parenthood To Target David Daleiden
Planned Parenthood is evil . Look at the nefarious use of quotations to say sex means different things to different people .
Naturally they relied more on the questions about abortion and " traditional family " to " prove " the hypothesis . In summary , this was a correlation study ( no causation proven my friends ) that relied on poor data which at best gives weak evidence in the opposite direction / THREAD
" Lefty " , the universal response to anyone running an anti-maga aka anti lies and bullsh * * campaign . Sorry buddy , but it's not an A ) or B ) choice . We don't have to A ) Have our noses in 45 ' s butt , listen to everything he says , and shun all others or B ) be liberals .
U . S . Conference of Catholic Bishops mull abortion , gun control
Shout out to U . S . District Judge Paul Engelmayer for recognizing that safe access to abortion is a fundamental right ! #AbortionIsAHumanRight
I often hear the anti-Blackness in tones of speaking on indigenous ppl and conversations , which is why I think some of y ’ all need that reminder ... also remember that slavery wasn ’ t a choice , so stop thinking that Black ppl are settlers .
This clip is from the BBC . Yet another abortion doctor admitting to killing " babies " and this one is okay with killing third-trimester VIABLE babies if the mother is depressed .
Zwykły ksiądz bardziej prawy od papieża Franciszka , który daje komunię zwolennikowi mordowania dzieci w łonie matki ! #CzytamBiblię #IPPTV #WielkaProstytutka
I'm following you and as many Patriots as possible #Trump2020 #WWG1WGA #QAnon #ProLife #KAG #FinishTheWall #2ndAmendment Patriots 🇺 🇸
Immigration is a Pro-Life Issue
#JeffreyEpsteindidntkillhimself
Dance Dance Revolution is clearly a commentary on the unintended after-effects of abortion in modern society at large .
😂 😂 😂 You ’ re insane ! Most Americans support abortion rights to VARYING degrees . Only a tiny minority are 100 % open to NO abortion or no abortion restrictions .
" Without the cultural cringe factor pro-life people wouldn ’ t be so fired up about this issue . " Cringe wasn't what set off the Christian right in the first place 40 or so yrs ago . It was , I believe , segregated schools and the tax-exempt status that was lost 6 yrs AFTER Wade ...
So , are you saying you now support #abortion rights , the #EqualityAct , the #EqualPayAct , , and AOC ? Because the tweet of mine you responded to says only that these things are #WhatTriggersConservatives--and you say no . Huh .
I consider it oppression that babies are murdered and that some people are lead to believe that getting an abortion is good for them . There are people of every race and religious background who are pro-choice and pro-life .
Kenneth Londoner | Why Fleabag's Phoebe Waller-Bridge Didn't Talk About Abortion on SNL
I'd wondered for some time if these Trumpkins believed ending abortion and marriage equality were so important that it meant going all-in for this crime boss president . Sadly , the answer appears to be yes .
. ' judgement problem is much wider & on the backs of dead babies & broken families . His foundation : providing people with tools . Yet : a tool without GOD is a easily a weapon . has done MORE to really help the poor : " JOBS " .
I AM DONE WITH DEMOCRATS KILLING OUR CHILDREN THROUGH : 💥 ABORTION 💥 SCHOOL SHOOTINGS 💥 ILLEGAL DRUGS 💥 RAPE 💥 SATANIC SACRIFICES I WANT JUSTICE NOW ! THEY MUST BE EXPOSED !
America will never be a socialist nation . There are only 2 genders . The government won't take our firearms without a fight . Abortion is murder . We need to secure our border immediately . Democrats are becoming increasingly radicalized and unhinged . Jesus is King .
The #RadicalBookFair is just around the corner , but BEFORE all that kicks off , we still have 2 rockin events : FRI 7pm Rise Up & Repeal-poetic celebration of campaign wins for #reproductiverights : SAT 11am Veganism , Sex & Politics :
I get the idea behind this , but I ’ m also concerned that it would deter philanthropic efforts and I ’ d also want to make sure the money is truly spent wisely . I also think there other priorities to focus on such as climate change , healthcare , pro choice , gun control , etc .
I respect everyone ’ s right to believe what they want , but the issue with me lies when pro-life women want to impose the pro-life agenda onto everyone . Pro-choice women just think women should have a choice . The lifers who think the right to choose shouldn ’ t exist rather than ..
Ive heard that on the 31st per a woman of God , that the Lord told her many portals were opened up that night and hordes of dem 0ns were allowed in as part of the thicker darknes that is coming upon the earth thes dem 0ns are more evil than we ’ ve seen before
I ’ m a woman before I ’ m a mother and that ’ s why I will always be pro-choice . Since it is impossible to know every pregnant person ’ s situation , I refuse to endorse policies that take away people ’ s rights to their own body and wellbeing .
“ Men once you have given birth to a human , you can have a say in women ’ s rights . Pregnancy and abortion is an internal thing between the mom and the fetus . You are external ” ~ my professor who is a dude Can ’ t preach this more ! ! !
Wtf ? ? ? Seriously . Wtf ? ? ?
p . s . JESUS IS GOOD NEWS NOT ABORTION # IDEAS .
FatherGod , which art n Heaven , I pray that U Cripple the Movement Of All Evil here on Earth . May you Twist the Tongues of these Devils that their Words Fall on Deaf Ears Lord God please Stop them Any & All Evil they Preach , Bring it back on them N10Fold In the Name of JesusChrist
Abortion covers up rape exploits women for profit harms & kills women kills minorities , girls , disabled , babies born alive 4.5 x ⬆ ️ death 65 % PTSD No follow up care or accountability Abortion = misogyny , bigotry , discrimination , human rts abuse
NEW EPISODE : In this week's Ann & Phelim Scoop we discuss ' bombshell video that shows Amy Robach talking about ABC's coverup of Jeffrey Epstein ! You won't want to miss this one ! #EpsteinCoverup Video : Podcast :
probably a sly way of having a stance on abortion but still getting dumb conservative style women to follow their insta
Time for to act or be removed . I have faith and will do what needs to be done .
Does Planned Parenthood donate money ? To Democrats ? They kill babies right ? Now that is real blood money ! !
Pro-choice all the way . No questions asked .
demi if you boo , I hope you go home covered in poo .
The question is not " What do we think of abortion ? " but " What should the law be ? And who decides ? " The one whose body is required to carry the fetus is the ONLY ONE who can make that decision . No politician or preacher can decide FOR her .
She is indeed pretty awesome , and this is coming from a pro-choice person !
By voting today , we can let anti-abortion politicians know that Virginian's reject their real agenda : to ban abortion and criminalize women , and instead want to live in a Virginia where every individual's right to bodily autonomy is respected , rather than threatened ! #RoeYourVote
Scientists saying Green New Deal not going far enough . Are we going to follow in China's footsteps and limit families to a single child ? Pro-abortion isn't enouigh . What about illegal immigrants ? Who is going to enforce on them such ? Free this , free that ? Thoughts ?
#WhatTriggersConservatives Damn ... where do we start ... #okboomer #facts #checksandbalances #BlackLivesMatter #pridemonth #prochoice #PlannedParenthood #StarbucksCupGiveaway ( cause ya know its red and war on Christmas ) #ElectionResults2019 #EqualityForAll #BarackObama #AOC
#voteblue if you like man periods , believe Epstein killed himself , love Hitlers love affair with Karl Marx , cry foul in election losses , accuse others falsely of what you yourself practice and get steered like sheep easily by MSM .. Oh and ..
It has nothing to do with being pro-life or pro-choice . Her words are unacceptable . I'm pro-choice but I've also suffered a loss . Our baby was wanted . Loved . Instead of turing this into a Democrat vs Republican issue , we need to focus on holding her accountable for her words .
Not so friendly reminder to all corrupt : it's been more than a full year since have passed good , pro-American bills in the House - gun control - keep pre-existing conditions covered - lower medication costs - extend Medicaid , - keep abortion legal #ImpeachTrump
Followed all , follow me #MAGA #PatriotsUnited #BuildTheWall #PaintOurCountryRed #ProLife #KAG #Trump2020 #VoteRedToSaveAmerica #PromisesMadePromisesKept #KeepAmericaGreat #PatriotsAwakened #DemocratsAreDestroyingAmerica #DemocratsHateAmerica
It was not an easy choice . But it was the one she felt was best for her and for her children . I am grateful that she had the right to make that decision . That choice should be the right of every woman , not politicians . Her story is why I am proudly pro-choice .
MeMe " My Father " McCain : Don't take muh guns ! But , war crimes , unfettered spying powers , and denying women their reproductive rights are perfectly fine !
Obviously people disagree quite intensely but political positions are also moral positions and advocating policy impacts your neighbor . While there are many grievously wicked political positions , if you're prolife abortion constitutes a unique offense .
But he ’ s pro-choice and pro-gun control so he ’ s not winning there either . Vanity , vanity , all is vanity .
Planned Parenthood releases extremely graphic sex ed book for ‘ the youth of today ’ | Opinion | LifeSite
