Stop unwanted pregnancies . Hence many women ’ s need for planned parenthood / free birth control . Make sense ? Now , what do you really smart people think should be done about the sperm donors in these scenarios ?
Latinos For Trump protest against Planned Parenthood in support of #ProLife About 2000 babies aborted a month in the USA , that's one every 20 seconds . There are more black babies aborted than born ! about 50 million babies aborted since ROE V Wade . 🔥 🔥 🔥
Folks still pro-Trump ? He didn't start this . It started with bakeries and wedding cases & the religious right's increasing political power . But Trump makes all things worst . When you only vote pro-life , your vote is anti-everything else .
Followed all 😊
If women do lose safe , legal abortions they will once again have to travel if they have the means to where they can obtain a safe abortion . Women w / out means will risk back alley set up to face unnecessary risks . Do we so soon forget the terror that brought about safe abortions ?
... WHY are you continually starting fights with anti-vaccination Tesla owners ? ? ? ⚔ ️ 💉 ☀ ️ 🚘 ⚡ ️
Pro-lifers in Northern Ireland react to forced legalization of abortion with #DarkestDay
I stood in the rain outside city hall for many a pro choice rally . Where were you all ? Taking democracy for granted .
Court rules legislature can't intervene in Planned Parenthood case - Wisconsin Examiner #wiunion #wipolitics #wisconsin
Everyone who's died in an ICE concentration camp , for starters . Then there's all the people who die because they don't have access to healthcare , then there's the people who died because the Most Prolife President Evah let his business partner do a genocide .
It's the Babies Body ! Not yours ! Wake up or go straight to Hell !
I hope at least SOMETHING I said got through . It was really tough to hear that abortion should be banned even in the cases of rape and incest . I felt RAGE .
I don't know what to say . “ High Priestess of abortion ” new President & CEO of National Abortion Federation " Abortion is a blessing and our work is not done "
You can't be in communion with God when you support killing his children in abortions !
They have made me more pro-life as a woman in every way . I used to be pro-choice until they started in with their it ’ s not a baby and we can kill them up to the date of birth if we want to . I just can ’ t side with their immorality it ’ s just straight evil no other word for it .
Antichoice groups refer to contraception as abortifacient . When they come into schools they discourage its use by focusing on side effects and making up stuff .
They came for immigrants and we protested . They came for transgender folx and we marched . They came for Planned Parenthood and we donated . They will not stop until WE . STOP . THEM . #Vote #Campaign #Contribute #Boycott
Anti choice activists engage in stochastic terrorism .
Absofuckingloutely NOT ! ! ! It ’ s 2019 ! ! ! If you ’ re against abortion , then don ’ t have one ! ! ! 💡
my abortion comin back for revenge 😆 😂
I certainly can't give divine grace . But I can be compassionate & sympathetic to victims . There are millions of people who can't have children & are waiting to adopt . Profit making planned parenthood makes it easy & profit from killing innocent babies that could be adopted .
👇 Yes ! And #HillaryClinton will never be President . Ever . #FourMoreYears 🇺 🇸 🇺 🇸
Democrats created this industry ...
Confusing for sure . If a man identifies as a woman and is against abortion , will she get her identity revoked ?
So you support abortion on demand ? Good for you !
In my opinion there is no difference between being pro-choice and pro-abortion because they both end in the death of an innocent human being ...
those pro life GOPers sure dont mind children dying ...
We invest in our teams and ourselves , join PPLA ’ s family in Pomona , CA Clinical Lab Scientist TEMPORARY Pomona , CA #CLS #lab
Planned Parenthood says " virginity is a made-up social construct " – Disrn
Latest : Virginia election results reignite abortion debate
Please join us in Aberdare Room at 4:30 to hear and so many others .
How many grown women would die without abortion access vs how many babies are currently murdered in the US each year due to abortion ? Women would still have a choice in the US , WITHOUT abortion . We have access to birth control , and emergency contraception in the case of rape .
Gomez's focus on border detentions and family separations has often been more pastoral than overtly political - - tbd on just how strongly the bishops will challenge Trump , whose abortion policy they largely support
This is good news , but abortion rights are still under threat nationwide . #StopTheBans
How you can get blocked from me .. 1 ) Hate speech on president Trump 2 ) pro abortion 3 ) bullying others We are to shine the love of Christ to others how are you possibly doing that by doing the three above ? ?
How about you provide words from the candidate himself ? Just because he might ve lukewarm about the heartbeat abortion bill does not mean he is pro-abortion . Also I noticr you did not push back on gun-rights .
So u picked pro choice .
Fact Check : blocked pro-life legislation at every turn as Speaker of the House #kyag #ketdebate #kypol
No man should ever force any women to go through abortion .. if you cant handle the responsibilities of become a father than either pull out or wear a condom .. but never make a women have to go through the hurt of killing an innocent child ... DONT ME to talk shit ..
Abby Johnson's ' Unplanned ' journey from Planned Parenthood to pro-life m ... via
We should support whatever decision the actual pregnant person chooses , including having an abortion if that's what she wants . And spare me the " natural instincts " nonsense . Not every woman wants to be a mother , and no woman wants to be forced to gestate .
this will only create a market of cheap , low quality abortion businesses . On the religious aspect , the most pious thing to do is to allow women to have safe abortions than to corner them into unsafe ones ...
No , it doesn ’ t “ basically ” trigger a miscarriage . A miscarriage is the loss of a life at the fault of NO ONE . Often due to chromosomal or other abnormalities of the baby . An abortion is the intentional ending of a life , often due to mere convenience .
I ’ m pro choice . This means if you want / need an abortion , I support your decision . If you choose adoption , I support you . If you want to give birth and parent , I support you . Choice looks different for everyone and everyone deserves the freedom to decide for themselves #prochoice
I am a democrat and theres so much with this statement . I would never in a million yrs consider having a abortion but i dont think its up to me to tell another woman what to do with her body .
See , that ’ s an argument for Pro-Life that makes sense . “ But I wouldn ’ t take the decision from someone else ... ” I like 🙌 🏾
It was literally taken and given to Quebec . How is that " pissed away " ? ? Millions to fund abortion in Africa . Millions to fight climate scam in Africa . Millions to Clinton Foundation . Literally billions pissed away , and you're making fun of Alberta funding Quebec socialism .
yes , yes it does Jer . Because without abortion , women are trapped in abusive relationships . Abortion bans are state sponsored violence against women .
In #Lombardia tutti invitati a #Pavia il prossimo Mercoledì #13Novembre alle 21 a incontrare ( #Presidente del #PopolodellaFamiglia ) su " La #vita non si tocca " : la verità su #eutanasia e #suicidioassistito . Con la collaborazione di varie associazioni #prolife .
Thank you for explaining the junk science of so-called Medication Abortion Reversal . #science #APHA2019
Some girls do the job very well 😂 😂
there are literally so many ways to answer this in true beauty queen fashion , and “ abortion is not an option AT ALL ” is not it . guess we ’ re not suriving the q & a portion this year .
In accelerating the promise , we're marching to #ICPD25 #NairobiSummit for abetter access to information & services on Sexual Reproductive Health and Rights for adolescent girls & young women in Kenya
God when an abortion baby enter heaven
Your anti-drawing clout posts , regardless of how viral they get , will not delete the problematic and oversexualized anime titties that fill every corner of my hard drive . You have no choice but to suffer as I masturbate furiously to your tears , and my anime boobs
you can ’ t be pro-life and then assault someone ? ? ? it makes no sense ? ? ?
Just finished listening to paloosi presser . Got 2 give credit , she's damn good spewing rhetorical BS . Amazing how these dems look #WeThePeople & str 8 up tell us how stupid they think we R . #WitchHunt #DemocratsAreCorrupt #Epsteindidntkillhimself #KAG #KAG2020 #prolife #BLEXIT
I thought you were " pro-life " this is #Killing a living tree ...
Nope , not my body not my choice . If she want keep it that her choice I support that . If she wants and abortion it's her choice I support that . No matter my opinion : her body her choice . Religion is for dumb people so we don't have that , I married since 15 years , still her choice .
You guys gotta read the comments ! ! ! People see RIGHT THROUGH Planned Murderhood and it ’ s incredible ! !
Thank God for #KanyeWest He ’ s going to save thousands of black babies from abortions at planned parenthood . #GodWins 🙏 #JesusIsKing
DOJ didn ’ t ask SCOTUS to review our victory in the #JusticeforJane case !
Planned parenthood sure has been pushing hard for intact fetal heads ...
GOP-controlled Ohio Senate approves two more abortion restrictions
Look forward to seeing both of them lose thought .
Prolife folks are being more aggressive in their approach . PAY ATTENTION PEOPLE . Alberta is showing us what the Conservatives are truly all about .
#LeftistHypocrites with a vengeance
Hey Boston if you're voting for city council tomorrow , just be aware that while Althea Garrison is an incumbent , she's only in office because Ayanna Pressley left for Congress . Althea voted Trump , and is against same-sex marriage and abortion . Vote for literally anyone else .
Texas #Repost prolife_prowomen _ • • • • • • Yet another missing child in Texas 😔 “ Jaya Trevino ( 2 years ) Last seen Nov 4 , 2019 in San Antonio , TX Vehicle : 2014 Nissan Sentra , Black Texas license plate #MKS1273 THE …
Beautiful Catholic Church - The Basilica of St . Mary , Minneapolis , MN ✝ ️ #Catholic #Jesus #Mass #TuesdayMotivation #Faith #Bible
No pro-choice person is using Jennifer ’ s son to justify anything . How about you and Lila don ’ t use Jennifer ’ s son to justify withdrawal of women ’ s human rights ? 🤷 ‍ ♀ ️
We are the pro-life generation and we vote !
How many points do you think the unemployment rate would drop if the Climate Change crazies , pu * * y hat wearers , ANTIFA , and pro-choice abortion protesters actually got jobs ? 🤔 🤔 #UnemploymentRateRecords
Anti-immigration , anti-reproductive rights , anti-same sex marriage , and climate change deniers . Ironic that the self proclaimed “ Irish patriots ” of the alt-right have more in common with the DUP than any other party
All I can come up with is that people who will have an abortion , and then try to reverse it , will come away with the impression that their doctor is a liar .
Thank You for The Mention ❤ ️ Follow #MAGA2020 Patriot ✊ 🏾 IFB 🇺 🇸 💞 Please Retweet 💞 Support & Click on Link & THEN Retweet #MAGA #GraphicArtist 🇦 🇺
Beware ! A hard-to-find Marxist " Catholic " website defending the errors of Pope Francis : Propaganda from its latest " Its Time " Newspaper attached . Gives itself validity by surrounding with articles of Sheen , Fatima , Pro-Life . Marxist SASK
Alabama , like other states , is 60 % prochoice .
How many hospitals are named after saints ? How many are named after atheists ? What religion endorses or encourages abortion ? BTW nice five head you got there .
We believe in the continuation and increased funding of Planned Parenthood because not only does it provide abortion , it provides cancer screenings , birth control pills , and sexual education for our youth ! #PlannedParenthood
Now I ’ m seeking attention cause I ’ m talking about my abortion 😭 but wasn ’ t I talking about this on IG and everywhere else
' Broad public opposition to completely overturning Roe v . Wade . '
Hindi ako anti vaxxer , pero I need to watch this .. To learn more about Vaccines , we have our choice to believe or not .. what is important now , we have the knowledge to know everything .. We have our choices what ...
The book Strangers In Their Own Land , explores the same principle in Louisiana . Vote for abortion , rather then a job , a future for your child and healthcare .
... and he gets a pass from the media because he is an advocate of baby killing ... my how we have fallen ...
I want to be a Republican , I believe in limited government , the power of the free market , individual responsibility , school choice , the pro-life cause , the dangers of socialism and a peace-through-strength foreign policy . But Trump makes it impossible to be part of the party .
Thought experiment for #ProLife : Woman has consensual sex and is raped the next day , does she get a rape exception ? #abortions #abortionpills #AbortionIsAWomansRight #prochoice #AbortoLegalYa #Abortolegal #Aborto
Scandals , same sex marriage , abortion reform , Brexit deal , burning bridges with everyone , increased support for a ui ... all on the DUP watch under DUP noses at a time when an electoral fluke made them the most " powerful " they'll ever be The incompetence is simply staggering
Here ’ s a List of 100 Members of Congress Supporting CAIR ( Hamas ) - This is why we need Laura Loomer for Congress-NOW
Pro-Life , Pro-Choice , Pro-Love : 44 days of reflection for finding a third way ... via
It is actually NONE of these things .
Thanks for the ride following all #Trump2020
Followed and Retweeted I already follow most MAGA / KAG so if I miss following you and you support President Trump , follow me and I will follow you back . MAGA / KAG Trump 2020 🇺 🇸
Oh mY gOd tHiS iS hOrRenDoUs But also will be pro-choice , and worse as someone on a FB comments thread they were pro-abortion . Abortion should be a fucking last resort , rare af . So much choice in contraception nowadays .
What ’ s that got to do with Kirk saying he was pro-life ? Are you just trying to distract from your lie ? Either prove that Kirk is pro-abortion or repent of your falsehood or be exposed as a a liar .
God bless your fight to save innocent babies
Patient Privacy Dispute Shadows Hearing for Last Missouri Abortion Clinic
* offer to say yes does not apply to same sex marriage , reproductive rights , gender equality , economic diversification , reconciliation , greenhouse gas reduction , fair salaries for public employees or accountable conservatives .
there's shitty people on both sides , but every single republican " opinion " is just pure evil to me . there's literally a reason all white supremacists , the kkk , and neo nazis support trump . from abortion , to anti lgbt , pro gun , and immigration stance , everything is just terrifying
Nie łudźcie się , że Platforma to jakakolwiek ulga dla kobiet .
Life Death #chooselife #andtherewaswar 14.12 . 19 Broadway Theatre , Catford
The KKK has nothing to do with a black woman deciding to have an abortion . But , 👏 🏾 👏 🏾 👏 🏾 good for you ... bringing up an irrelevant point .
I think there are Dems that , since they don ’ t like Pres Trump , Have lost all common sense . I had friends who were conservative yrs ago that later were Obama supporters . Smart people that turned stupid . It ’ s shameful .
When Brooke mentions you had an abortion to Mercedes
That sounds pretty sick and twisted to this #ProLife advocate .. 👇 🏻 🤮 🥴
#Conservatives and #Evangelicals who claim to be #prolife are passing laws that will kill #women . #Ireland provides lessons in what will happen if they succeed . #feminism #prochoice #TrustWomen
Surely , the land of the free and the home of the brave ... and you cannot pray for babies ? Surely , that is overreacting . But planned parenthood , pregnancy needs death to ‘ cure ’ it !
I personally believe " on demand " abortion should be safe legal without restriction and accessible up untill viability unless a threat to the mothers safety / health or a diagnosis in the fetus precludes it from meaningfully survival after birth .
Antichoice DEMS : Reps . Nick Rahall ( WV ) Collin Peterson ( MN ) , Jim Matheson ( UT ) , Mike McIntyre ( NC ) , Dan Lipinski ( NC ) and Henry Cuellar ( TX )
I ’ m proud to announce Martin Cannon ’ s endorsement as I roll out my " Defend Life " policy agenda . " Jeremy Taylor will be welcomed in Washington . I urge pro-life voters in #IA04 to support Jeremy Taylor for Congress . ” - Martin Cannon #IAPolitics Read more :
As I watch episodes of #thegrapevinetv George ’ s faces are EVERYTHING I needed . Especially the episode about Pro Life and Pro Choice ! He was taken back .. I loved it .
And if everyone has equal rights , than no one including a fetus has the right to use my body without my permission . So #ProLife movement you do not believe in equal rights .
Low life scum .
I also had an unplanned pregnancy and had an abortion , because I didn ’ t want to face the consequences of my grossly irresponsible behavior . I was a coward , and it was the least empowering thing I ’ ve ever done .
General thoughts on abortion ?
#AbortionIsMurder #AbortionIsMurder #AbortionIsMurder
😣 un médico abortista hablando sobre el aborto
What commitments would you like to be made ? How will you make your voice heard to ensure that every woman and girl have access to Sexual Reproductive Rights Services and ensure that #SheDecides #NairobiSummit
Lisa Page edited Mr . Flynn ’ s 302 . Powell plans to request dismissal due to egregious government action .
So “ pro-life ” , but don ’ t want loving homes to adopt kids already in foster care . 🥱
The Roe Act in MA : - will legalize abortion through all 9 months of pregnancy - eliminates the requirement for minors to have parental consent to have an abortion - removes any requirement for doctors to provide medical care to babies who survive abortions And more ! #prolife
There is no such thing as abortion apologetics , but the phrase makes me giggle , so thanks . 😂
Why wouldn't you get an abortion ?
🗣
No . They aren ’ t stupid . They are single issue voters . And that issue is abortion . As long as the Republicans remains the ‘ pro-life ’ party , they ’ ll keep voting them in . It ’ s literally their only issue . / 1
Totally agree and I ’ m standing on the pro-life platform as always !
🛑 🌟 Arrest these thugs who disrespect our police officers . Mayor deBliasio support NYPD ! 🛑 CBSN New York's Dave Carlin has the latest on the NYPD vehicle vandalized and officers taunted in the latest incident of disrespect towards police in New York City .
Well , Rep Hice , we have a serious problem w the way the Constitution is being bastardized to allow , perhaps , America's greatest enemy , ever , to actually hold a place of power in the f'ing House ! This abortion of justice called needs to be erased by any legal means !
I find your source quite questionable , as it's a " pro-life " . PEW doesn't have a dog in the race .
I won't link because most of the stories are from Life Site News , but former Archbishop Donald Cardinal Wuerl referred to refusing communion to a pro-choice politician as using the Eucharist as a " weapon " . He did not support denying communion .
Disgusting waste space .
' Abortion not an option ' : Miss Universe Philippines 2019 Gazini Ganados reacts to Georgia's Heartbeat Bill
#Trump every time . show your support for our presidents everybody please vote please retweet for a very high total votes . Do you support impeaching our President Donald J Trump
" Trump has only raped four people ? Good grief , what is all the fuss about ? " - - #prolife christians
your performance tonight in #HeelsOfHell2019 #Belfast was powerful and touching . Thank you for supporting our fight and lauding our win ! #prochoice #mybody #WomensRights 😘
These Halloween decorations are scary but not as scary as ' s extreme pro-abortion stance ! Get out & vote for #ProLife on November 5th #kypol #halloween2019
Woohoo ! #Win for #Life in #SouthCarolina
“ We want to say very clearly that if you ever help a friend , tell her about the possibility of terminating a pregnancy , or even get her the medicines – we are here for you , ” she said .
Kobieta , Polka , położna pro-life w piekle Auschwitz , toczy się jej proces beatyfikacyjny - Stanisława Leszczyńska I diabeł - SSman dr Josef Mengele - pseudolekarz , proaborcyjny , anti-life , zbrodniarz w oświęcimskim obozie
Everyone is also entitled to the right to life . Defund the infanticide giant of America , Planned Parenthood , of all taxpayer funds . Your source of that dark money you speak of so frequently . you should drop out of the race . Epstein did not kill himself
LEFT IS 👁 ️ " W0KE " CULT : ✅ FAITH = Inter $ ectional antiscience dogma ✅ OFFERINGS = Virtue Signaling ( eg Abortion wrship , trans kids ) ✅ HERESY = " HATE SPCH " spch we dont agree w ✅ AP0STATES = Any 1 , espcially an unwoke minority ✅ EXC 0MMUNICATION = Cancel culture ✅ IDOLATRY
“ Mess on a napkin ” What a disgusting way to put it ! ! I was 22 , 1st child & told by a dr , “ U ’ re going into spontaneous Abortion , it ’ s Gods way of taking care of mutations ... ” how was I going to tell my husband ? I stayed in bed until my 2nd trimester ( an entire month ) & he was wrong 👇 🏻
I ain ’ t gonna mess up my life for a mistake , abortion is not sinful ... Misogyny is .
Jesus was pro-women . No way he would be anti-abortion . And calling it murder or infanticide or whatever crazy nom-du-jour you are saying doesn't do anything for your cause . You come across as a whacko .
⬇ ️ ⬇ ️ ⬇ ️
Kentucky : Tomorrow you will decide what kind of future you want . ABORTION & SANCTUARY CITIES OR NOT . The Choice is clear . #bevin2019
NEW ARTICLE : Abortion clinics in Ohio & Missouri are fighting to stay open in the face of burdensome and medically unnecessary state regulations that threaten access to reproductive health care , testing the limits of the constitutional right to an abortion
Planned Parenthood also sells the baby body parts ! #FrankensteinLike
Is it too late for your mom to get an abortion ?
Trump abortion . It made Putin a hero . God bless U Comrade !
Planned Parenthood in Annapolis 34 minutes .
Love the podcast , but let ’ s be honest , you ’ re preaching to the choir . When people re-elect ppl like Katy Tran who introduce the infanticide bill and rewon her seat last night . We ’ ve got 30-50 year project on our hands here .
Dear Young Brother , you may not care now because your young but this zina every where will results in murdering Allah's creation , Abortion or you having kids that you Abandon out not being able to house or provide for them , either one abortion or abandoned is a huge sin ,
It is not trump supporters who harrass dems . I didn ’ t like obama , did you read his books ? But conservatives did not act like this , they respected ppls rights
BLOG : Why have over 40 years of pro-life efforts barely put a dent in the culture of death ?
okay but now lets say we reach a point where we know someone is emotionally and physically abusive , failed to get a parent license ... why should her getting an abortion be her choice ? why cant GRN make that choice for her ?
Every anti abortion person on Twitter : " I used to be pro choice , then I saw the error of my ways ! " Its like the Walk Away " movement " trying to portray becoming more conservative as a natural maturation rather than decline in empathy and critical thinking .
Once Tomi said where she stands on abortion I have not been able to listen to her . I was almost shocked when I found out she is pro-choice . She's a traitor to conservative values .
i feel bad for her that she didn't figure him out before she was lumbered with a kid she didn't really start out wanting . Also , the plausible deniability would have gone better if he'd gone down the abortion route , so there's a whiff of possibly using it as a means of control ? 🤢
Where's the " pro-life " crowd ?
Awww thanks Pastor , for your judgement . BTW I think they already know . And since I ’ m 💯 pro-life & for religious freedom , I think I ’ ll be OK .
A real POS .. thanks KY
“ The idea that Beshear was able to champion all these anti abortion restrictions and then gets voted out is very representative of what might be going on ” in Kentucky , says
OH NO GAZINI
1 ) As impeachment approaches , it is becoming painfully clear that we may have to choose between surrender and conflict . We can not depend on senators to defend our president . They didn ’ t repeal Obamacare . They didn ’ t build the wall . They didn ’ t defund planned parenthood .
What did the Bible say about ppl who are set aside ? If you are a worldly man you are not a man of God . Planned parenthood , Hollywood , etc are not vessels of God . Where are you ?
You are deceived into believing God approves of abortion . You have been warned ... Hell is real .
Documentary Exposes Abortion-Satanism Link " Abortion : A Doctrine of Demons " will be released on November 7 on Created Equal Films ' YouTube channel . ” View short trailer for documentary . #Satanism
