Every unborn baby is a created , individual masterpiece of God . To kill one of these innocent ones , receives His special attention . God will be busy with the officials of Planned Parenthood on Judgement Day .
And all Pro-American , pro-Christian , pro-life , and pro-Constitutionalists must stand and be heard in support of our President !
I ’ m with Trump , he ’ s Pro-Life . Followed and Retweeted MAGA / KAG Trump 2020 🇺 🇸
Wow . Wake up . Changing the language doesn ’ t change the facts . An embryo and a fetus are both humans . Whether they are “ compatible with autonomous life ” or not doesn ’ t change the fact that they are humans . Abortion targets those humans and kills them .
Because abortions are done until about 24 weeks into pregnancy , a period during which the foetus has no consciousness and can't even feel pain , Karen ! #prochoice #woke Also this question is from my school Moral …
Your issue is actually anti homeopathy , and anti science , and anti fact , and anti choice . That's all 1090 % clear in what you say and your actions . There is a reason for this and it's 100 % NOT to do with understanding or comprehension - why not be honest ? #homeopathy
Please win !
#BuildTheWall
Think of it as a late term abortion & be happy for the pro-choice convert . 😁
I think another part of it is also the availability of OTCvmorning after pills . Planned Parenthood is the reason why I never became a teen mom . I got free birth control from them , so I never needed to terminate a pregnancy . I wish to hell and back people would realize that . =[
They posted this on Facebook and so I replied " The right to life is a basic , fundamental human right too . But you're going to ignore that I guess " After the comment became the top comment and their followers got ripped to pieces in the comments , they deleted it . Cowards .
#Swamp_Busters #1466B - Bad boys , bad boys , what u gona do , what u gona do when they come for you ! !
As per the 2nd point , it is already very difficult to access abortion services . Traveling to YYC or YEG is time intensive , cost intensive , & there are very few supports for folks with barriers to get there . 4th , Drs provide comprehensive medical supports for patients across ...
The law requires Doctors to refer patients who ask for a referral for MAID . No to bill #207 .
" Germline genome editing neither treats an existing disease or prevent one for a prospective patient ... " paraphrasing - This ( unmet need ) only exists if one constructs the idea of need around narrow , unchallenged concepts of reproductive rights . Peter Mills . #policysummit
My condolences to the family and friends of #FallenHero #Police #Officer #JonathanDiaz #EOW 02Nov2019 #NeverForgotten #BlueLivesMatter #AllLivesMatter #AllGaveSomeAndSomeGaveAll #ServeAndProtect #StopKillingUs #EnoughIsEnough #PutTheGunsDown #Comply #Comply #Comply #Comply
Right . The same people advocating abortion want to take our guns away . We ’ re going to keep our weapons to protect ourselves from people like them .
One reason why I'm not a democrat [ there are many more . . . ]
I ’ m pro-choice don ’ t get me wrong , but wtf part about this did they think was okay ?
1 slagged use of GND slogan / blocked me when I said : " Have you considered that both countries need substantial action .. on green policies & can cooperate on plans ( like was done on acid rain ) ? No movement owns words . We use " anti-choice " here , as they do in the USA . #cdnpoli
Adding : abortion is gravely morally evil in all circumstances , but the idea that it's a " You go , girl ! " female bonding moment is horrifying . Almost no one who has an abortion feels that way about it as time goes on .
“ How California ’ s College Student Right to Access Act Will Break Down Barriers to Abortion Care ” by NARAL
When you make a purchase from the online Christmas Maker ’ s Market , you are helping S4U bring the hope of the gospel to abortion-minded individuals nationwide . Shop now : #ProLife #GospelforLife
What They Don ’ t Tell Women About the Dangerous Abortion Pill Mifeprex May Kill Them | -
You don ’ t know everyone ’ s situation in life . I ’ m not saying that abortion is a great thing , but I think that what and I are saying is that it ’ s not your life so you shouldn ’ t be making the decision for countless women .
60,000 , 000 👶 have been killed in the womb since Roe was handed down by activist judges . Every life is a gift from God and deserves rights . I'm a proud pro-life advocate who will stand up to protect life each day in Congress . #Bret4Iowa #IA04 #iapolitics
Get an abortion
Few Gains on family planning 👇 🏾 - Lower risk of maternal death - Lower risk of anemia , poor pregnancy outcomes and complications related to miscarriage or unsafe abortion . #Nakedconvos2019
Did a woman even type this ? 🤔 🤔 🤔 If not , back off . I couldn't imagine getting an abortion either , much less being raped or getting pregnant . And I don't want to . I don't think any woman ' wants ' an abortion .
Big OOF 😶
Hey , now what we ’ re you saying about atrocities ? What part of this hell is Pro-Life and Christian ?
Missouri Could Become the First State in the Nation Without an Abortion Clinic . What Happens Next ? 【 JUST STAY THE F AWAY FROM OUR BODY . We don't need the govt to tell us what to do with it 】
Exactly , if she doesn't want an abortion she doesn't need to get one but she shouldn't think for a second her opinion should stop someone from getting an abortion . It's not her body
Hold on . I ’ m going to assume you think a women doesn ’ t value herself if she had an abortion . Right ? But if she doesn ’ t have one then yes . He should pay . He was there . He ejaculated . His doing . His financial responsibility from conception
Yeah ... I assume you guys have gone all around the prolife community and checked this out ? That's why you are so sure we don't want to talk about this ?
Is it more misogynistic for Botany voters to support Jami-Lee Ross ( seems to hate women personally ) , or Christopher Luxon ( enthusiastically anti-choice ) ?
#Prolife and murders more #Blackbabies than all others combined ? ? ? #babyparts
I ’ m so tired of these homophobic , pro-life people on campus 🙄
Feeling apathetic about #prolife voting ? 3 reasons to vote on Tuesday : via #prolife
Are you completely obtuse ? I'm the opposite of liberal and am adamantly pro life ... thus the pic . I am not a prolife hypocrite to support a Kurd baby killer . You do that .
American Catholics and Christians are always like this .
Nothing about abortion , abuse of the churches finances are they living under a rock ? I hope they all read the catechism before saying anything about immigration because they seem to push for something else .
I ’ m prochoice . Sorry be mad if you wish . But some people cant have children or be forced to have them . I ’ m not gonna make a rape victim have a baby . I ’ m not gonna make a child have a baby and someone who physically can ’ t have a baby I won ’ t make you . Not my body . Not my choice .
Still at this point it's a little one sided because yall say men don't have an opinion when their pro life but if their pro choice they can have an opinion ? That's fucked up , either men have an opinion or no opinion , yall should choose one .
I did not . The definition of “ elective ” in abortion care is often actually due to medical necessity , which is denied by some medical facilities . This isn ’ t difficult to grasp . It ’ s laws of antichoice fanatics killing and endangering the lives and health of women , as usual .
I ’ m really tired of pro lifers acting as if mfers wait until multiple months of growth & numerous ultrasounds just to decide for an abortion . Y ’ all do know the people who get abortions get them asap right ? Not monsters who will sit & watch a baby grow just to be like “ nope nvm ”
Didn't a bunch of Hollywood people just say they weren't going to film in Georgia because of their abortion laws ?
So called Catholics like Nancy Pelosi supporting abortion damages the church ..
And anti vaxxers , anti 5g , anti abortion , islamaphobics , etc . The far right know these type of people are easy to target and manipulate so they scoop them all up to support their cause too
That is a better perspective to have , the reality is however the need for abortion will never go away . It can be minimized greatly , but I doubt the number will ever fall to zero . I personally think that the best way to help minimize the amount of abortions is to have -
teenage girls from california will get pregnant and have an abortion , teenage girls from vegas get pregnant and start a story highlight on ig
When I make it to Lansing I will be taking a stand to protect a woman ’ s right to choose . #Healthcare
This motherfucker is exactly what Virginia deserves
#LetterToTheState legalizing abortion leads to more abortion . We do not want to invoke God's wrath because of taking the lives of innocents
Don ’ t Make Love By The Garden “ Gates ” Love Is Blind But The Neighbors Ain ’ t ! ! Too Little To Late Billy Boy ! ! Bill Gates addressed his ties to Jeffrey Epstein : ' I made a mistake ' - Business Insider
Excited to be participating in the #walkforlife this morning for Low Country Pregnancy Center who care for and love pregnant mothers and their families ! Providing actual FREE care for women ! #ProLife
#AllLivesMatter ❤ ️
Clinic worker troubled by the faces of late term abortion victims - NRL News Today : via #latetermabortions #abortion #antiabortion #prolife
THIS DR is now officially BREAKING the law ! The police just drove on by . #prochoice #feminism #feminist #abortion #equality #womensrights #mybodymychoice #humanrights
Missouri : Where they don ’ t keep track of your guns , but they do keep track of your periods . Hard pass . #moleg
It was probably most of the 69 bishops who felt abortion was not the preeminent issue ...
Their decisions , if they get their way , could end my life . I know many others who will be harmed by it . There are millions we will never hear about . Pro-life my ass ... Why is it that one with excellent coverage & benefits , feels that others should not be entitled to the same ?
The Chicago Abortion Fund , where I am , helps people with limited means to access this kind of medical care ( ) and if you aren ’ t in Chicago or the Midwest , they should be able to recommend an organization near you that could use the help !
OH FOR FUCKS SAKE 🤬 🤬 🤬
Food Stamps , free medical , abortion up to birth is what this shit scum wants . All are pathetic garbage
What ’ s your idea of true conscience .. live birth abortion or illegal immigrants running over innocent people while driving drunk or giving testosterone to minor females or maintaining wars in the Middle East where their is countless death and displacement ! ! .. Sleep well 🐑 ! ! !
Brandon ... ignore him . He does not sound Christian to me but God will be his judge . Thank you for all the work you do encouraging Democrats to walk away from a party that boos God and promotes and CHEERS , CELEBRATES abortion . Best advice you can give him is to #WalkAway !
Cameron win proves Kentuckians will hold there noses and vote for Black candidates if you whitewash them abortion , guns , and dog whistle conservative points . He did not run on enforcing laws , equal protection , or KY Constitution . Loses if he does .
There are zero candidates in the Democratic Party the are pro-life . How can I claim to love God and also support the Democratic Party .
hes voiced his support for chris brown , a woman beater , hes said openly that he's pro-life , which is an issue that has zero to do with him , he's supportive of eminem , who has also created hundreds of misogynistic lyrics . how could i , as a woman , have anything good to say abt him ?
I trust Collin Peterson ( D-MN ) . Pro-life . 1 of 2 D's to vote 👎 on impeachment . He's the only one .
LRT Not that if you want an abortion for “ ” ” selfish ” ” ” reasons it ’ s wrong . It doesn ’ t have to benefit anyone but yourself . As I always say , abortion is good actually .
In other words , protect abortion from Christians .
With so many choices to help you transition , which device helped you make the switch to a healthier lifestyle ? #chooselife #vapelife #vapenews #vapemods #vapepod #podsystem #vape #vaping #maketheswitch #smokingcessation #helpingothers #vapeon
IFBP 🇺 🇲 ⛵ 🍊
As far as things that need addressing when it comes to forming consciences ... Abortion / Euthenasia ................ Poverty / The Environment
Zz
🤔 Sounds like double standards to me , or else they discovered she was a registered Republican . 🤷 🏻 ‍ ♀ ️ BTW ... Epstein didn ’ t kill himself ! #ExposingFakeMedia
The woman running for village ward trustee might be wildly pro choice , but the village doesn ’ t have anything approaching control over abortion law or funding , so that doesn ’ t matter
Absolutely . And the millions they give on a regular basis to things like planned parenthood that kill babies ... it's just gruesome . I can't take it . They'll applaud Roman Polanski and his crimes against children but they'll condemn our . Unbelievable .
. please #ChooseLife
Without the CFPB , forgien " aid " funneling back to dem politicians , planned parenthood , NPR funding and pay-for-play shrinking ; democrats are dying on the vine . Without crooked money and leftists MSM , how much of the Democratic party is real ? Illusion ?
Fuck all the way off . I have 3 medical issues . I had a failed iud / condom combo . Found out I was pregnant from pain and vomiting blood . Was told by doctor . " my best advice is abortion . Your meds are going to the embryo . The embryo doesn't need it , you do . You'll get worse "
Not bot bot . 4 followers ? Ha
It ’ s not docs working at abortion clinics ... obviously those docs are ok with it . That ’ s not what is at issue here . Any doc ... don ’ t go to med school and become a doc if you aren ’ t willing to terminate pregnancies ? Is that your position ? And what about the baby parts ? A-ok ?
This is sick . Of course an old white man keeping track of the uterus of mostly African American women who can not effort to buy birth control pills and go to Planned Parenthood to receive medical help .
Abortion is another way for women to avoid personal responsibility .
" Vote Blue No Matter Who " even when they're fervently anti-choice ? even when they let insurance companies engage in #ClassMurder ? even when they routinely pour the budget into war profiteers ' bank accounts ? even when they barely even pretend to oppose the GOP ? Matty = paid shill
Catholicism and being Pro-Choice / Pro-Abortion are antithetical beliefs . #BidenFalseCatholic
I understand your frustration Sir but I have a choice of a surrender monkey , a thick racist abandoneer of the working class or the triumvirate of anti-democracy , in our case , Green . I will exercise their " green " option by not driving to vote .
Over 1 billion babies killed since mid 1970 ' s Abortion is a crime against humanity Abortion is a crime against humanity Abortion is a crime against humanity Abortion is a crime against humanity Abortion is a crime against humanity Abortion is a crime against humanity
Fuck off . No one is having an abortion on a healthy baby that late . If you care about the fetus at 8 months though perhaps throw money into research to prevent stillbirth .
Humanity has to take a back seat to maintain the stance of abortion . And once euphemisms like " choice " and " women's healthcare " and " reproductive rights " are used , the deflections from reality make it easier to embrace the lie .
THE SUICIDE WAS APPARENTLY ASSISTED but in Law that ’ s still not murder , there are many terms like abortion manslaughter and others that are used to describe deaths ? ? ? So even though he was assisted in his own suicide , doesn ’ t make it murder ? ? ? Case Closed ? ? ? 😂 😂 😂 🤡 🤡 🤡
Crazy to think people only believe women deserve reproductive rights
Gotta be up at 10 am for my planned parenthood appointment but that's ok because it's right near my house and I dont work till 6 pm so . Nap time then
We urge you all to sign this petition by the Polish Women ’ s Strike to do with Polish religious extremists at the #NairobiSummit . This needs support urgently as #ICPD25 starts tomorrow ( ends Nov 14 ) ! #IMarchForSafeAbortion ( Petition in Polish & English )
What pro-lifers do you talk to that don ’ t ? Stop listening to Hillary and mainstream media . What you said is completely false . There are plenty of healthcare centers that are prolife that advocate birth control and educate as such .
Sick of extreme attacks on abortion - which is a legal and constitutionally protected medical procedure , practiced by physicians for decades ? Fight back . We will NEVER go back .
Amen Karen ! 🙏 Thank you dear Ladybug 🐞 #BlessedAndGrateful #BlessTrumpSupporters ❤ ️ 🌹 🇺 🇸
While smoking a cigarette , lol
Anyone ever realize when libs have a miscarriage ... they lost a baby . When libs have an abortion ... it ’ s not a baby , it ’ s a group of cells 🤔 🤔
What I would like to do to the school administrators that Allow this purple abortion
Minnesota has escaped the wave of extreme bans that has swept much of the U . S . But that doesn't mean we can grow complacent . Take this quiz . You might be surprised to learn just how restricted abortion access is in Minnesota .
US Christian who refuses to pay taxes until abortion is defunded has first big win in court
Pregnancy is not a punishment for having sex . It is sometimes the natural result of having sex . The birth of a baby is the natural conclusion of pregnancy . Killing the human being that resulted from your actions is homicide . #prolife #prochoice
Que le puedes pedir tu a un " prolife " que es de lo que apoyan el cambio climático a través de panfletos , trípticos y demás . O a esta persona que ni siquiera tiene foto que no sabe diferenciar entre autismo y Asperger .
You're absolutely right , ! We need to make sure abortion remains accessible and safe for those who seek it . #FLReproFreedom #AskFLLeg
Instead , Trump and McConnell have together been brazenly rigging our courts to attack access to health care , reproductive freedom , LGBTQ equality , worker and consumer rights , and protections for the environment . #StopTrumpsTakeover #courtsmatter
Why Twitter ? ? ?
NEW : Senate Republicans just confirmed Lee Rudofsky to a LIFETIME federal judgeship . He has a horrible civil rights record , including on LGBTQ equality , reproductive health care , voting rights , and equal opportunity . He ’ s unfit for this position & will bring bias to the bench .
You're a twisted man . You defended a demented abortion doctor where 2,246 bodies and body parts of innocent helpless human babies brutally aborted ( KILLED ) were found IN HIS HOME and now you're defending brutal serial rapists and murderers ?
Rly rly excited about this project that I got to create with ! It has all my favorite things : ❤ ️ abortion ❤ ️ beautiful art ❤ ️ warm fuzzies ❤ ️ me spending too much time in after effects ❤ ️ dreams for culture change and a better world Hope you like it !
Michał Krajski : " Nieplanowane " - film niedoskonały , ale pokazujący prawdę o aborcji i Planned Parenthood .
Maybe she should pray more ! But she first needs to repent of all the babies that have been killed due to her support of abortion .
Why hasn ’ t this liberal activist judge been impeached
Prawdziwa historia pracowniczki kliniki aborcyjnej , która postawiła się swojemu szefostwu , bo : 1 ) chciała się odpłacić za zwolnienie jej za obijanie się w pracy ; 2 ) ruch pro-life zaoferował jej kasę w czasie jej kryzysu finansowego . * christian rock w tle intensifies *
Our BFF of will be speaking next week at on #socialimpact investment for health and #reproductiverights in Latin America . SWOON . Don't miss this panel ! #ForoIDEA2019
Word on the streets is Apryl got an abortion . #LHHH
Not preeminent cuz ? Certain Bishops support abortion as a solution to climate change ? Gasp . Get it right now ! Life over death . Jesus IS the Lord of Life ! Bsp Strickland stands with our Lord & is correct .
Mary McAleese has the temerity to lecture on the rights of the child " having advocated for abortion . Does she expect us to take her seriously ?
Absolutely . Anyone blaming Kyrie for this team ’ s performance is dishonestly peddling their choice of one of the many anti-Kyrie narratives .
We will make our #prolife voice heard louder than any election 🗳 before !
Nothing Neil says in that interview was anything different than the things one might hear at a Bernie Sanders rally . The man was defending abortion and socialized medicine . When did that become conservative ?
LMFAOOO
I also have numerous others in my cohort who wouldnt take on / continue with a client seeking an abortion , wanting to transition , or who starts " blaming them " for white supremacy . ( Also note that 25/30 people in my cohort are white . We have 4 chinese and 1 native / black student )
plus rape , abortion & melted cupcakes ( she seems to assign equal weight to all three ) , intercepted mail , bullying , and her house - she expects anyone to believe that she could afford a house on 1 acre in NEWPORT ? ? ?
Maybe not you personally but it's what the pro-life movement advocates for .
All we need to know about who Biden Worships ...
Gal 3:1 Who hath bewitched you , that ye should not obey the truth , before whose eyes Jesus Christ hath been evidently set forth , crucified among you ? This only would I learn of you Are ye so foolish ? having begun in the Spirit , are ye now made perfect by the flesh #wicked
Followed all Patriots , please follow me back ! 🇺 🇸 ❤ ️ 🇺 🇸 ❤ ️ 🇺 🇸
Pro-Abortion Doctor : ' You're Not Pro-Choice ' If You Don't Support Elective Abortion In the 8th Month #RicoTheDems #ArrestThemAllNow #ImpeachObamasJudges #news #feedly
If it ’ s towards it will be reversal of the Reformation , stop women working , no abortion under any circumstances , eradicate anyone who doesn ’ t comply with his interpretation of Catholicism ( aka IS ) .
Sick , but true .
Feminist brainwashing on college campuses for over 50 years . Took a turn for the worse in the 90s as networks like MTV introduced abortion advocates to the mainstream popculture
Yes , you did , but I rejected your attempt . That statement is incorrect ; an ectopic pregnancy is a condition that is resolved by terminating the pregnancy , which is commonly called an " abortion . "
This is a guy who not too long ago compared pro-life advocates to slave owners in the 1800 ’ s . You challenge him on these idiotic statements he will in turn block you .
Senn has been a wild card in SC abortion debates . If she doesn't support anti-abortion bills , she could be challenged in the 2020 GOP primary by someone who pledges to support more restrictive abortion bans . But supporting those bans could hurt her in the general election
There are two lives in every pregnancy . Abortion violently kills one . Whether one has a womb or not is irrelevant .
But . But . Abortion is the the most important issue . Right , bishops ?
Abortion leads to the ghost baby boss battle in luigis mansion .
We should put a lot on the national ballots for referendum voting - gay marriage , how many genders are there , climate change , Obamacare , free college , building walls , fed funding for abortion , national concealed carry , and of course AR - 15s . Plus many more issues . Let's do it .
And ... Planned Parenthood is a liberal idea . 🇺 🇸 🇺 🇸 🇺 🇸
In Brazil it isn't illegal to provide info on reproductive rights . In accordance to rights of freedom of expression reassured by #MarcoCivil da Internet , we'd like to have further information from Brazilian ISPs about why these blockings are taking place
Cool . Just dont assume I'm anti choice because I said we need to include preventive methods as aggressively as autonomy rights . Dude came at me like I was anti choice when all I said was abortion is taxing on the woman's body and shouldnt be used as a form of contraception .
and modern feminism is a direct result of the oversexualation and deChristianzation of culture . making women into nothing more than ' holes ' via porn , pump and dump and abortion culture understandably makes many women into feminists .
It's a sad that the countries in the Prolife have history of killing their citizens for demanding the right to live in a conducive environment . Even Libya with the mass murdering of Africans can claim ProLife Tag . #ICPD25Ke #ICPD25DoesNotRepresentMe #ICPD25 #ICPDNairobiSummit
Everyone should be pro-life . If you're not , you're a sick person .
Real doctors must follow HIPPA laws . Planned Parenthood usually gets a pass because of thier political agenda . Leftist privilege .
#obamagate
Every Democrat I talk to is ok with abortion , therefore I believe they all are still in need of a renewing of the mind .
As city councilor from Indianapolis District 17 , I'm proud to stand with Planned Parenthood in Indianapolis today and every day . " #ElectionDay #IndyVotes #StandWithPP
The " Pro-life " party protect the fetus not the children
Pro-life is neither of those things . Good talk .
Top 10 Abortion Myths : #10 Late-term abortions are only for health problems #abortion #abortionmyths
#ThxBirthControl I grew up in poverty , in an abusive home . Planned Parenthood and birth control helped me not have an unplanned pregnancy or need an abortion but I ’ m #ProChoice . PP provided free hekthcare to a poor student just out on my own too . Thank you too !
