uhhhmm ? ? If anything , being a mother has made me more pro-choice . Not everyone is fit to be a parent .
Don't believe in abortion , but he MUST address this .
Wdym almost everybody is either pro-life & pro-guns / speech or pro-choice and anti-guns / speech .
Thank you for speaking the truth against abortion African Pro-Life Leader Bashes Abortion : We Must “ Respect Human Life From Womb to Tomb ”
Were people " forced " before abortion was invented or did they just " deal " with the repercussions of " their " own frivolous actions , as they should have and did . Less be label rightly so as a deadbeat parrent .
hahaha funny .
Obowiązkowa to powinna być edukacja seksualna , a nie żenująca katolicka propaganda anti-choice sprzeczna z nauką .
Why is no one talking about the elections happening next week on Nov . 5 ? These races are critical to protecting reproductive freedom while this admin is hell-bent on destroying #RoeVWade . Find your prochoice champions : #ScaryStats
LOS PROVIDA , prolife . Pro la peli esa pedorra que salió inesperado . Pro fetos ingenieros .
Total tool
" I'm a Conservative . Pro-Life . Pro Second Amendment . Pro Religious Liberty , " he wrote on Instagram .
I know you think abortion is unnecessary violence . I disagree but really it doesn't matter since neither of us will have one anyway . If you don't think animal agriculture is unnecessary violence , you are simply wrong .
so like people that sit outside planned parenthood all day with pro life signs : do yall not have day jobs ? do you get hungry ? what if you have to pee ?
We 💗 Thank you so much for running the updated news regarding the ongoing violations & the challenges to women ’ s reproductive rights in Kansas City Missouri We appreciate your work
If you believe in abortion , then that means you care more about animals then you do an unborn baby .
The original tweet referenced homosexuality which attitudes on didn ’ t see much change until recently . Here ’ s the last 20 years . Notice the rapid change compared to womens reproductive rights .
Teen Who Lost His Legs in Botched Abortion Became a Champion Wrestler #AAG #AAG2020
i ’ ve been on my period for going on 5 weeks now and i don ’ t have health insurance until january and i think it might be time to hit up planned parenthood and scream for help
Abortion is murder . " Beware of false prophets " .
This campaign is starting to feel a lot like the abortion that was the GE17 campaign ...
Just got compared to Hitler bc I ’ m pro choice .
A nie chować głowę w piasek . Zamiast wesprzeć , Prezes potraktował działaczy pro-life jak upierdliwe moskity , więc przygarnęła ich Konfederacja .
Pretty sick link and source . You lost me at anti immigrant . Stephen Miller is ANTI ILLEGAL IMMIGRATION . PERIOD . Trying to draw inferences with the old Hitler canard is specifically distasteful since Stephen is Jewish . Also a capitalist , pro life , pro Israel , etc . wrong party .
Sorry but abortion is not healthcare it's murder ! There is a spark of light at the moment of conception ! 60 million + unborn children have been murdered since Roe versus Wade ! ✝ ️ 🛐 😢 😥 😪
What ? Has Barr broken his duck and indicted someone ?
Yeah because Trump obviously didn't pay his mistress to have an abortion and it's not like people haven't died at the border or in border patrol under Trump's administration
homosexualuality is illegal , abortion is illegal ... but u will be very stupid to believe it doesnt happen in kenya ... stop pretending yall #LetterToTheState
Your #prolife voice is needed ! Urge Congress to pass the Dignity for Aborted Children Act ⏩
Puts way too much power in the hand of bureaucrats . Anyway , the wage gap has been debunked . Abortion is still widely available ( which I think is tragic ) and it ’ s illegal to assault all people including women .
" O que me comove é isso " Exatamente : vocês pro choice vivem de emoção , de narrativa Enquanto nós pro life fazemos textos e mais textos explicando a individualidade do feto
Moving back to Ireland and having 9 pregnancies killed my mother !
None of those things . That's socialism which I don't like but it's not something to hate . Funny thing you mention about slippery definition . I'm called all sorts of names - fascist , nazi among them . Because I believe in nations , I'm pro life and generally a conservative
List of orgs destructive to Irish sovereignty , antiIrish in sentiment , pushing #abortion , #LGBT , massimmigration is much longer & includes #Irish Gov & Seanad #Trinity #irishmedicalcouncil #nuig #ucd #nwci #srhr #ihrc #amnesty #ifpa #ihrec #ihg #unicef #WHO #NWCI #icpd #unfpa #UN
Then don't get an abortion . The Bible doesn't say abortion is murder , in fact it instructs on how to give one . If sin is sin , then an abortion is no more sinful than your pride or you swearing . You can't have that both ways . Same with homosexuality .
From 2018 , and still Relevant !
This is pretty damn good . 120k votes , in extreme left environment , pollster is impeachment pusher w over 300k followers , and we lead with 53 % if you haven't voted , please do so , & #kag #prolife R E T W E E T ! !
The Juice lead USSR was the first country in Europe to legalize abortion . It also made the learning of Darwinian evolution compulsory in the schools and banned Christianity in the schools . What a great regime to emulate ! Leftists : dogged repetition of failed govt's .
Protesting parental notification for abortion in FL legislation today with PP with 18 amendments they weren't ready for . Felt like a jack rabbit every time they called my name " I rise to support this amendment " ‼ ️
There's no babies involved in an abortion . There's certainly no " girls "
We ’ ll be meeting women who have suffered greatly due to El Salvador ’ s #abortion ban . What message would you like us to pass onto them ? #sixreproglobal
We need your help Brendon . This is all poised to be enshrined in New Zealand law . Through the Births Deaths Marriages and Realtionships Registration Bill and through new abortion legislation .
#AbortionIsMurder #PureEvil #ChooseLife #GoodvsEvil #DarkToLight #StopAbortion #SaveTheBabies #WWG1WGA #WeThePeople #PSBArmy #MAGA #EnoughIsEnough 💔 #ProLife
I ’ m a pro choice Democrat . I ’ d love to see use regain the pro choice anti choice narrative ..
Choose Life #ProLife #AbortionIsMurder #ChooseLife
How about ask EVERY single male politician IF they EVER caused a woman to NEED an abortion . THAT is something I would judge harshly with my vote vs a guy who never did and is pro life .
I ’ m staying that states can vote on abortion being legal in that state
Well duh , so is the pro-abortion argument . Anti-abortion : Killing helpless human beings is immoral . It should be stopped . Pro-abortion : Killing helpless human beings is totally moral as long as they aren't born yet . Then we keep them comfy before they are killed .
No shave January-December #prochoice
I made two entire movies on this exact same contradiction from and ( they are both featured in the sequel ) . Great words from Matt below . Watch the films at
But there is no real screening for women , for even an obgyn to objectively consult . Irresponsible people run provinces and canaduh - so is anarchy the solution ? No . Abortion is as ridiculous of an argument as anarchy is .
#Luke18 : 5 #DearLord #ShadowBans me . I 🙏 You INTERVENE between them and me . Deal with them . In #Jesus ’ Name . #POTUS45 #Shadowbanned #ProLife #JesusIsLord
Sure sounds like Republicans are admitting their 2019 abortion bill is a failure . Interesting . Didn ’ t they claim it covered ALL the bases ? How many decades will #Missouri voters be one issue voters ? For an issue already covered ? Really ? Does nothing else matter in your lives ?
This guy is my hero
should the option to report illegal pedophilia also be up to the victims ? what other crimes should not be reported as a matter of course , if reasonably suspected ?
So you ’ re not refuting that Planned Parenthood is a bone fide non-profit org and you ’ re not arguing that they have a profit motive in providing abortion services . Instead you merely refuse to recognize that a nonprofit can be allowed to add to its assets .
I find it ridiculous that you don't know the difference between a fetus and a human being . Especially one that is not viable , like under six months or so . My newborn is sleeping on my lap , so I actually have some experience with this . Have you ever carried a child to term ?
at the same time , reporting this story and playing around with this tool was demoralizing and infuriating . the lengths women have to go to access abortion healthcare ... this is not a new revelation but seeing the roadblocks laid out in PP's own helpful way was deflating .
Abortion groups have put $ 3 million into this year's state legislature elections in Virginia . Wow
Abortion is always homicide . Perhaps , the choice to " ruin lives " was having reproductive sex when you knew the consequences of so doing would result in an obligation you didn't want . If you don't want the stress of being in office don't do things that will get you elected .
Fighting Stigma : DUP motion turns into heated debate about abortion rights : ... that in pregnancy both lives matter – the mother and the unborn child . ... calls for a Perinatal Hospice Care facility or service in Northern Ireland to be ...
I am making informed comments . I think you're just confused because I'm using facts and logic ; they're not common currency in the anti abortion movement .
God have mercy .
Bad planning ! Nottingham Citizens meeting this evening clashes ...
Followed all ! Thanks for including me and for introducing so many new MAGA peeps ! 🇺 🇸 🇺 🇸 🇺 🇸 🇺 🇸 🇺 🇸 🇺 🇸
A ja sobie wyguglowałem i tak jak przewodnicząca z PiS w poprzedniej kadencji nie pomogła w uchwaleniu zakazu aborcji , tak i ta nie przeszkodzi . Inna sprawa , że nikomu , w tym środowisku prolife , całkowity zakaz aborcji na rękę nie jest .
Nope , that ’ s anti-choice rhetoric . People use euphemisms all the time , no issues with that . The sole purpose of abortion is to stop a pregnancy from progressing , not to ‘ kill a baby ’ .
#TIDEWATER VIRGINIANS , #STOP PLANNED PARENTHOOD FROM #KILLING OUR BABIES , #KEEP OUR #CITIES SAFE FROM #BECOMING #SANCTUARY CITIES & #BRING SCHOOL CHOICE TO
Amen ! This is the real idol ! Not statues of mother earth / Our Lady of the Amazon ...
So than you agree , Planned Parenthood should not be government funded ?
Abortion in NI ...
I see the contradiction , I just wonder how one boycotts an abortion clinic ... and whether you were referring to the left's opposition to people protesting outside them .
But im pretty sure my father still thinks im a virgin im just glad he minds his business lmaooo . But i also I ’ ve never catched anything or had to have an abortion like some out here so im still a good girl
Prolifers , please leave your comments here ! Thanks ! #prolife #unbornlivesmatter
It was great visiting the LifeCare Pregnancy Center in Thief River Falls . Jackie Doyle , the Center ’ s executive director , was very helpful in teaching me more about their programs . It ’ s inspiring to see their dedication to protecting life , our most precious gift . #chooselife
The SRHR of people with disabilities has long been neglected in Bangladesh , said speakers at a workshop . ⁣ Comments were made during a journalists ’ orientation workshop on the SRHR of people with disabilities in Dhaka . ⁣ ⁣ Find out what they said :
The pastor is out of her lane !
" Lived experience . " Unlike all the experiences your child never got to live . You may be " ok " ( so brave ! ) but your baby is not , in fact , ok at all
Relying on science can be dangerous , pro-abortion activist warns - NRL News Today : via #science #abortion #fetology
Joni Ernst is “ very proud ” of her attempts to defund Planned Parenthood , she ’ s voted to confirm dozens of anti-choice judges & she continues to attack women ’ s reproductive freedom . Stand with Theresa Greenfield in the fight to protect women ’ s rights > >
Maximum hypocrisy !
Im pro choice for both genders
Deliberately ending your lineage by abortion is a form of suicide . Then and there you degrade your philosophical opinion of life . You admit it's superficial and superfluous . Not only is your kin interchangeable and disposable but you acknowledge you are too
If you was sneaking round high school gettin hit and going to planned parenthood not telling ya mom or dad YOUR OPINION IS NOT VALID .
Is it just me or do “ pro-choice ” only respect one option ? #abortion #adoption
Men just tryna take all our rights huh ? Smh first right to abortion , then they wanna use tampons , now former man whores wanna be at gyn appts with their daughters .. sad 😞
Followed back
Hillary ’ s foreign experience is selling our uranium to our arch enemy , the Russians .
Not as pro-life as all that , then .
I ’ m a pro-choice Warren-voting progressive who has ~ personally ~ crafted Tester ads specifically for pro-choice independent expeditures . I ’ m intimately aware . He is to guns what this argument is to choice . Stop fucking around . Engage the point at top of the thread .
Reversing Trump ’ s trans service ban is obv . Warren importantly tackles deeper discrimination of trans vets excluded from equitable VA healthcare . She also talks reproductive justice at VA including IVF & abortion . These layers are missing from other candidates ’ published plans
This is all about a hatred of white " patricahy " Early feminists were all prolife but man hating 3rd wave feminists hijacked feminism . THEY then targeted the unborn . Leftists are the spawn of 3rd wave feminists . It's why they never condemn Islam , yet Islam treats women worst .
it can be a LAST OPTION . it's a must to try your best to find a way na masave both ang mom og ang child dili kay abi in danger ang life sa mama , iabort nalang dayon ninyo .
Abortion care is one of IPPF ’ s key pledges at the #NairobiSummit . By 2022 , we will accelerate universal access to safe abortion by expanding the provision of quality and women-centred comprehensive abortion care . More : #ICPD25
But , in writing that , you know what came to mind ? the GOP NEVER makes promises like that ... they NEVER over promise , hell , they don't even tell people they will do what they can for them . They just scream about guns and abortion . and they win ... and they KEEP winning .
But Democrats want late term abortion under ANY circumstance regardless of it being to save a mother ’ s life or mother just changed her mind . I can ’ t agree to that . I can ’ t
The left 1 ) Anti American ( western imperialism ) , 2 ) Anti Moral - late-term abortion and anti-police 3 ) Attack faith and spirituality - attack Jews in the streets call out Anti-Israeli policy - Pro Iran . See this is the plan of a Communist there should be no billionaires or guns .
Website for #ProLife healthcare workers in #Ireland .
It's in the actual article . " She wants to keep the baby , but her boyfriend ( who is paying her rent ) said he would kick her and her daughter out if she doesn ’ t have an abortion . "
$ VRUS ... How low will VRUS drop tomorrow at the stock abortion clinic ...
I stand by the constitutional ( not moral ) argument I offered in my controversial oped : if a 16 year old has the constitutional right to have an abortion without state or parental interference , how could she not have the constitutional right to engage in consensual sex ? 1 /
It is pointless to assert that you are " pro-life " if you work ceaselessly on many levels to make life impossible for so many children once they pass into this world .
Though I didn't buy their recent CNN case . Look how Project Veritas exposed Acorn , Google , New York Times , & Van Jones . Even that Planned Parenthood incident back in the summer so they have enough creditability in my book .
Gonna be lit when she applies that approach to their next abortion case
Did u know Depo Provera was Deadly ? The FDA , Pfizer , Planned Parenthood all knew and failed to tell us and my daughter is now dead ! Did u know ? Let's talk . #JusticeForBre #JustNo2DepoProvera #SavinglivesThroughInformation
Tony Jones and the q show are ok BUT the people on the show my god lol dim witted , socialist , anti rights , anti god , pro criminal , anti self defense , pro abortion , pro trans kids , pro sharia , pro men in women's toilets . may aswell be called California or the Clinton show
Thank you for including me GreyBeard ! Rt'd . IFB Patriots .
Obria is a bad actor who has received ill-gotten $ from taxpayers but I BEG YOU please don't view them as an outlier--anti-abortion fake clinics are HELLBENT on grabbing tax $ s for their schemes . Evidence of another :
Well that was horrific . Weather you ’ re for or against abortion is irrelevant , we should all be against ignoring underage sex trafficking and sexual abuse . 💔
Molnar was a dick , but the ad didn ’ t give him much to work with . Maybe he can shed light on the behind the scenes disfunction leading to this fiasco.Then again he did very well for being paid for getting out of dodge.His first team was more competitive than this abortion
There is no judge , no " pro-life " policy , no deregulation or tax cut that makes it ok . It is not ok . It was never ok . It never will be ok . Not only is it not ok , it must be fought .
Believe whatever religion your like , adhere to whatever philosophy you like . The extent of your beliefs stop at your own medical decisions . My family does not adhere to yours , my family wouldn ’ t exist if my family adhered to your beliefs . My family deserves to be here . #prochoice
I didn't say you were harassing me , you are harassing others though . And this anti-choice account spreads misinformation and lies .
A teenager has pleaded guilty to killing his girlfriend , 17 , and their unborn baby because " she left it too late for an abortion " . 😪 Murder is a leading cause of death among pregnant women , in the US . 😔
If you actually look at Nazi Germany they were more socialist but took it radically like Government schooling ‘ s kind of like what the Democrats are doing right now or how about planned Parenthood has been known to tell parents to kill kids Who have a possibility of autism
I am trying to imagine the media pursuing a Muslim about views on abortion and gay marriage with similar zeal ... Not remotely likely .
Even if you support abortion this should scare EVERYONE ! We have religious freedom in this country . Just because an individuals religion goes against the progressive doctrine should not be an excuse to violate peoples religious freedom ! Take this to the Supreme Court !
True story : I'm teaching a course to teachers . For an assignment , I asked them to each revise their lesson plans to be culturally relevant . Do you know that someone really submitted a lesson to teach students how to research by researching " immigration , " " abortion , " and " gangs ? "
" Abortion is self defense " ? Let's explore . Like : " it's your life or theirs " OR " your convenience or their life " ? Quick , I need to know bc there's this lady in front of me buying coffee for what looks like the whole office and it would be convenient for me to knock her off .
Thank you so much for including me Patti ! Rt'd . IFB .
Hmm . I remember a Labour MP talking about the " aggregate moral wisdom " of parliament . The complexity around abortion was in reconciling ethcial differences rather than practical ones , surely ? Beleifs rather than interests ?
This was what happened yesterday morning at Sai Wan Ho , #HongKong . Before this #HongKongPolice gun shot another 21 yr old student , he tried to subdue this weapon-less young man by pointing gun to his left chest . #HongKongPoliceState #HongKongPoliceBrutality
Dating crisis , STDs , dating appts , The Bachelor Australia , abortion , and why Joe Biden shouldn ’ t receive Holy Communion . Checkout the #podcast #catholic
😙 🇺 🇸 #AmericaFirst #Trumpit #Motivation #Love 🙏 ❤ ️ #veteran #world #TheGreatAwakeningWorldWide #ProLife #women #asians #invest #LegalImmigrantsForTrump #JobsNotMobs #blexit #MAGA #Trump2020 #Brexit #BestPresidentEver …
10 ) Because , see , as much as people argue about Roe V Wade , abortion isn't REALLY something that's argued about in the courts . Most of the court battles have to do with how abortion providers are structured ; screeching about Roe V Wade is just easier for dumbass activists .
ABORTION is not health care ! Christ what has happened to the morality of our youth ? It just doesn ’ t seem to exist anymore ! 😳
He must be one of those pastors preaching the Talented Tenth propaganda that Planned Parenthood and leaders of Black Churches use to promote racist abortion rates .
Check this out . A buddy made it . #humanlife #prolife
Aquí si podemos ser pro choice agusto jóvenes
America dead . But he has as much chance as a baby in Planned Parenthood
👏 🏼 i had one of the worst experiences with pregnancy . i was chronically ill , briefly died during childbirth , my baby was not alive when she first came out , and it was just overall an AWFUL experience . I will FOREVER be #prochoice
Sooo she should ’ ve had an abortion is what y ’ all saying ? Cause pregnancy comes with having sex ... I bet they coparent better than a lot of y ’ all 🌚
1 . The mass number of migration flooding this country concerns me more than Black Americans coming out of the Democratic Party . I ’ m all for coming out of the deception but abortion has killed so many that their now the minority of minority . Yet those coming to our country wil not
Your GF want u 2 meet her family , When u get There ... The Elder Sis is Ur ex GF.The yngr bro is d guy u were fighting over a girl.Her dad is d doctor who advised u 2 stop coming with girls for abortion.And finally the mom is the sugar mommy who just bought u a car . What will u do ? ?
Boy the Left really , I mean really hates pro-choice people ... when it comes to schools .
I ’ ve noticed all of the “ conservative feminists ” ( oxymoron ) have nothing to say about the clear attack on women ’ s reproductive rights in Alberta . You know who I mean 🙄
A female #HongKong protester was gang-raped by the . This is how protestors are treated after being arrested . #china #HongKongProtests #chinazi
I realized as a teenager , the hoe parent will berate you for being a hoe and wholetime they done had an abortion at 15 & you ain ’ t even seen somebody naked yet 😭
This can ’ t be a crime the baby born in the 3rd trimester and the liberal ordered and abortion .
This is infuriating ! #Hippa #Keepoutofmyvagina #Violations #Period #Womensrights #Disturbing #Mybodymychoice
Cultural conservatives want to die on certain hills out of conviction , fine , but don ’ t expect centrists in the CPC to accept a federal election defeat because Leader Scheer couldn ’ t articulate a coherent policy on abortion or same-sex marriage .
HAPPENING NOW : Dr . Colleen McNicholas , Chief Medical Officer , and pro-choice advocate Jeni Box testify before Congress on anti-choice attacks on abortion access in in Missouri . 🎥 Watch live here :
I ’ m right there with you . Add the rank and file who claim to be “ pro-life ” christian voters but vote against all the life-saving helps that represent Jesus ’ values while pretending their stand is righteous . I was done with them decades ago .
Adorable , niño . Me lo como . ¡ ¡ ¡ No al aborto-asesinato de niños ! ! !
No , it doesn't . saw how pro-choice women organized in 2017 at the 1st Women's March , so they started having actions in place by the 2nd Women's March . By November 2018 , women had helped Dems become the House majority . Women are working on 2020 . Bye Bye GOP !
It's not about the baby . It's about the pregnancy Abortion and financial responsibility are not comparable
I have no manners for pro-life propaganda . You guys use scare tactics to get people to believe in what you say because you have no factual basis . Only shitty opinions . Move on Jayne you ’ re a stupid cunt anyway ( there ’ s those manners )
Antichoice groups oppose contraception .
There she runs ...
I am glad she , and others , does so .
👉 Her body . 👉 Her choice . The EU 🇪 🇺 is committed to continuing its support to sexual and reproductive health and rights . #NairobiSummit #ICPD25
Yesterday I asked Alexa when #ElectionDay is and her answer was horrifically wrong . Election day is TODAY . Get out there and #vote ! ! Build your ballot , find your polling location , know the prochoice champions you're voting for - all by using our guide 👉 🏼
Its kind of ironic that she would come at you concerning Animal Rights when they are the party : - Threatening Bill of Rights at various levels of society . Students protest & interrupt conservative speakers . - antifa - Late Term Abortion - Threatening the Church become PC or $ - 2A
what ’ s your stance on abortion
Yes , I think third-trimester abortion are horrific . No , gay people shouldn't be discriminated against . Judge away . Keep it coming .
piece of garbage abortion advocate
TW : be careful some words may be triggering I agree . I myself admin is struggling badly . I for one would never inflict worry or hurt on another person . Dark plots should never contain suicide self harm abortion rape ect . No matter how serious things are this is unacceptable .
CNN is just mad that the pregnant mother didn't die so planned Parenthood could get more fetal body parts
What about prolife ? Why are you against President Trump . Catholics need to vote prolife .
